,comment,like,time,title_list
258,사회주의자들 YTN임직원은  양심선언 하고 자유민주주의로 전향하십시요.,0,1 day ago,"[세상만사] 한국, 중국 3-0으로 꺾고 월드컵 예선 '2연승'"
259,사회주의자들 YTN임직원은  양심선언 하고 자유민주주의로 전향하십시요.,0,1 day ago,"[세상만사] 한국, 중국 3-0으로 꺾고 월드컵 예선 '2연승'"
260,아나운서가 말이 짧네. 싹수가 없네,0,1 day ago,"[세상만사] 한국, 중국 3-0으로 꺾고 월드컵 예선 '2연승'"
261,민재야 너도 최고야. 그래도 손흥민 잘모셔  너 보다 잘하잖아,0,1 day ago,"[세상만사] 한국, 중국 3-0으로 꺾고 월드컵 예선 '2연승'"
262,또국뽕 브라질 아르헨티나있다. 박문션씨 적당히하세요,1,1 day ago (edited),"[세상만사] 한국, 중국 3-0으로 꺾고 월드컵 예선 '2연승'"
263,1:10 여자아나 말도 안되는 개드립.. 수준 낮네,0,22 hours ago,"[세상만사] 한국, 중국 3-0으로 꺾고 월드컵 예선 '2연승'"
264,"안보인다고 댓글, 방송으로 함부로 떠들지말라",0,1 day ago,"[세상만사] 한국, 중국 3-0으로 꺾고 월드컵 예선 '2연승'"
265,이기재  빼쇼,0,1 day ago,"[세상만사] 한국, 중국 3-0으로 꺾고 월드컵 예선 '2연승'"
266,이기재 뭐임,1,1 day ago,"[세상만사] 한국, 중국 3-0으로 꺾고 월드컵 예선 '2연승'"
267,클스만호가 어니라 손홍민호다. 아무 전술도 없는 감독에게 너무 과한 치사다.황의조는 너무 뻔뻔한 ㄴ 이다. 클린스만이 자기 딸이 그런 경우를 당해도 그런 ㄱ 소리를 할까?,0,1 day ago,"[세상만사] 한국, 중국 3-0으로 꺾고 월드컵 예선 '2연승'"
268,아나운서 맞나?저희국민이라니대한민국 국민보다 높은 대상이 어디있냐?국민이 곧 국가인데 ,0,13 hours ago,"[세상만사] 한국, 중국 3-0으로 꺾고 월드컵 예선 '2연승'"
269,여자 앵커 참 오도방정 떠네..ㅋ,0,1 day ago,"[세상만사] 한국, 중국 3-0으로 꺾고 월드컵 예선 '2연승'"
270,박용우 빼라 ..,0,1 day ago,"[세상만사] 한국, 중국 3-0으로 꺾고 월드컵 예선 '2연승'"
271,아프리카 bj 별풍에 ㅁㅊ놈 데려와서 뭐하는거냐,2,16 hours ago,"[세상만사] 한국, 중국 3-0으로 꺾고 월드컵 예선 '2연승'"
272,클리스만호?   여기도  모지리가  기자인가?  손흥민 호 입니다클리스만  바지인거 모르세요? 차씨가  감독 연습 한다고  독일도 버린 클리스만  대리고 왔다는 설이  있음,0,1 day ago,"[세상만사] 한국, 중국 3-0으로 꺾고 월드컵 예선 '2연승'"
273,댓글300,0,1 day ago,"[세상만사] 한국, 중국 3-0으로 꺾고 월드컵 예선 '2연승'"
274,수다가 많아 게스트가. 다 말하고 대답 좀 해라. 엠시 기질이없네 낙하산이야,0,1 day ago,"[세상만사] 한국, 중국 3-0으로 꺾고 월드컵 예선 '2연승'"
275,"진짜 엄청 별로 못하더라. 난 유튜브에서 난리길래 울나라 축구가 엄청난 줄 알았는데, 이게 다 국뽕튜브였음. 하... 다시는 유튜브 축구반응은 안 본다. '중국축구, 절망했다. 손흥민에게 눈물의 사죄를 했다' ㅇㅈㄹ",1,1 day ago,"[세상만사] 한국, 중국 3-0으로 꺾고 월드컵 예선 '2연승'"
276,중국이긴걸로쇼하네동네축구 하면서,0,1 day ago,"[세상만사] 한국, 중국 3-0으로 꺾고 월드컵 예선 '2연승'"
277,ㅇ,0,1 day ago,"[세상만사] 한국, 중국 3-0으로 꺾고 월드컵 예선 '2연승'"
278,박문성 ??  넘 시끄럽고  !특정 선수들만 빠는 ..이기제는 문제가 크다.,0,1 day ago (edited),"[세상만사] 한국, 중국 3-0으로 꺾고 월드컵 예선 '2연승'"
279,이해하기 힘듬 이길 상대를 이기고 왜들 이리도 좋아하는거야? 일본을 이겨야지 그리고 일본은 이미 우리를 따라왔고 더 좋은 팀일지도 모른다는 상황까지옴 약자를 이기고 너무 니대는 것도 좋은 모습은 아니지,0,1 day ago,"[세상만사] 한국, 중국 3-0으로 꺾고 월드컵 예선 '2연승'"
280,중국 원정이잖슴. 게다가 소림축구때문에 선수들 부상걱정도 했었고,0,1 day ago,"[세상만사] 한국, 중국 3-0으로 꺾고 월드컵 예선 '2연승'"
281,이기제  어떻게 해야 할까,1,1 day ago,"[세상만사] 한국, 중국 3-0으로 꺾고 월드컵 예선 '2연승'"
