,comment,like,time,title_list
746,The BEST!!!,0,4 days ago,DEAN - DIE 4 YOU (Official Visualizer)
747,It's so great to hear Dean's voice again. Great song.,3,5 days ago,DEAN - DIE 4 YOU (Official Visualizer)
748,crying so much omg i have been waiting for so long,0,4 days ago,DEAN - DIE 4 YOU (Official Visualizer)
749,praise for this medicine,1,2 days ago,DEAN - DIE 4 YOU (Official Visualizer)
750,여전하네 좋다,2,3 days ago,DEAN - DIE 4 YOU (Official Visualizer)
751,I'm so glad you came back!,0,2 days ago,DEAN - DIE 4 YOU (Official Visualizer)
752,"진짜,,, 어디 있다가 나타난겨,,, 늠 죠타...",1,4 days ago,DEAN - DIE 4 YOU (Official Visualizer)
753,I’m living for this he just drops his music randomly and I wasn’t prepared for this masterpiece 🫶,8,5 days ago,DEAN - DIE 4 YOU (Official Visualizer)
754,Welcome back brooo! Aku sampe udah ada anak weh nunggu kau comeback,0,2 days ago,DEAN - DIE 4 YOU (Official Visualizer)
755,그리웠고 듣고 싶었고 보고싶었고 반갑고 감사하고,0,4 days ago,DEAN - DIE 4 YOU (Official Visualizer)
756,...️‍화이팅,1,4 days ago,DEAN - DIE 4 YOU (Official Visualizer)
757,딘아 오래기다렸다 앨범을,0,2 days ago,DEAN - DIE 4 YOU (Official Visualizer)
758,Finally,1,1 day ago,DEAN - DIE 4 YOU (Official Visualizer)
759,"It’s been a long time, Dean. I’m really happy to hear your voice once again 🫶",6,5 days ago,DEAN - DIE 4 YOU (Official Visualizer)
760,"Die 4 you의 대상이 설리일까 하고 생각했어요.페르소나:설리의 단편 중 하나가 4:클린아일랜드. ‘4’가 죄를 고백해야만 통과할 수 있는 입국 심사장. 설리가 떠난 후로 긴 공백도 이해가 가고, 4년만의 컴백이기도 하고요.",5,3 days ago (edited),DEAN - DIE 4 YOU (Official Visualizer)
761,크 첫소절 듣자마자ㅠ,2,3 days ago,DEAN - DIE 4 YOU (Official Visualizer)
762,crazy song,1,2 hours ago,DEAN - DIE 4 YOU (Official Visualizer)
763,"계속 기다리고 있었어, 계속돌아와줬어DEAN은 나의 청춘이다私の永遠の青春だ",0,3 days ago,DEAN - DIE 4 YOU (Official Visualizer)
764,finally he's back,0,3 days ago,DEAN - DIE 4 YOU (Official Visualizer)
765,이런 목소리를 다시 듣을 수 있다니 정말 다행이에요 ㅎㅎㅎ,14,5 days ago,DEAN - DIE 4 YOU (Official Visualizer)
766,형… 제발 곡좀 많이 내줘 ㅠ,1,2 days ago,DEAN - DIE 4 YOU (Official Visualizer)
767,what im feeling rn is exactly how i felt when exo came back 3 years ago with Lay :ccc ️,0,1 day ago,DEAN - DIE 4 YOU (Official Visualizer)
768,YOU'RE THE ONE I WANT,0,4 days ago,DEAN - DIE 4 YOU (Official Visualizer)
769,finally my pookie is officially back from that horrible accident ,1,3 days ago,DEAN - DIE 4 YOU (Official Visualizer)
770,미쳤다 다시 돌아왔다,1,3 days ago,DEAN - DIE 4 YOU (Official Visualizer)
771,"I can only describe this as a total MASTERPIECE! . Dean is a next level artist. .. No! rather from another world! The lyrics, the mix of sounds, his voice, everything is absolutely incredible. Welcome to the king !",12,5 days ago,DEAN - DIE 4 YOU (Official Visualizer)
772,Finally i can be at peace,0,4 days ago,DEAN - DIE 4 YOU (Official Visualizer)
773,"딘 오빠 기다렸어요,,,ㅠ",0,2 days ago,DEAN - DIE 4 YOU (Official Visualizer)
774,IT'S BEEN A YEAR DADDY!!!!,1,3 days ago,DEAN - DIE 4 YOU (Official Visualizer)
775,IS THIS REAL??!,0,4 days ago,DEAN - DIE 4 YOU (Official Visualizer)
776,NO WAY DEAN COMEBACK,1,12 hours ago,DEAN - DIE 4 YOU (Official Visualizer)
777,"sounds so ethereal, just as expected from dean. missed you trbl!",8,5 days ago,DEAN - DIE 4 YOU (Official Visualizer)
778,thank you so much for coming back papa,0,2 days ago,DEAN - DIE 4 YOU (Official Visualizer)
779,This song has Krystal Jung vibes,0,4 days ago,DEAN - DIE 4 YOU (Official Visualizer)
780,"omg im screammm!! welcomeback my dear, nice song i love itttt",1,2 days ago,DEAN - DIE 4 YOU (Official Visualizer)
781,왕의 귀환.....? 정말 기다렸슴니다....,0,3 days ago,DEAN - DIE 4 YOU (Official Visualizer)
782,Dean welcome back I missed you.,1,2 days ago,DEAN - DIE 4 YOU (Official Visualizer)
783,"Dean thanks for coming back  I stuck around all this time cause you’re an artist who never disappoints. The artistry, the soft angelic voice, the meaning behind the lyrics. Song of the year honestly. So glad to have you back ",8,5 days ago,DEAN - DIE 4 YOU (Official Visualizer)
784,I need Joji and dean to do a collab!!,0,3 days ago,DEAN - DIE 4 YOU (Official Visualizer)
785,너무 오랜 시간동안 출연하지 못하다 보니 가사가 마치 팬들에게 보내는 사과문인 것 같습니다.,0,3 days ago,DEAN - DIE 4 YOU (Official Visualizer)
786,thank you for coming back,1,8 hours ago,DEAN - DIE 4 YOU (Official Visualizer)
787,SOLID TALAGA!,1,3 days ago,DEAN - DIE 4 YOU (Official Visualizer)
788,Ahhhhhh I’m so exited for moreeeee,1,1 day ago,DEAN - DIE 4 YOU (Official Visualizer)
789,the world is healing when dean release a song,30,5 days ago,DEAN - DIE 4 YOU (Official Visualizer)
790,ㅠㅠㅠㅠㅠ와,0,3 days ago,DEAN - DIE 4 YOU (Official Visualizer)
791,Kangen banget DEAN ,0,3 days ago,DEAN - DIE 4 YOU (Official Visualizer)
792,RETURN OF THE KING!,0,2 days ago,DEAN - DIE 4 YOU (Official Visualizer)
793,ㅋㅋㅋㅋㅋ 하도 ai커버 많이봐서 위켄드 다이포유 ai로 커버한줄ㅋㅋㅋㅋㅋㅋㅋ,6,1 day ago,DEAN - DIE 4 YOU (Official Visualizer)
794,i thought some random person was trolling that DEAN released something again,1,3 days ago,DEAN - DIE 4 YOU (Official Visualizer)
795,노래 하나로 심금을 울리네 가슴이너무 아려와,6,5 days ago,DEAN - DIE 4 YOU (Official Visualizer)
796,"We  be loving you too, Dean. Welcome back? Tfs",1,2 days ago,DEAN - DIE 4 YOU (Official Visualizer)
797,"Thank you, Lord!!! ",0,4 days ago,DEAN - DIE 4 YOU (Official Visualizer)
798,NO PUEDE SER ESTÁ VIVOOOOOOOOOOOOOOOOOOOOOOOOOOOOOOOOOOOOOO VOLVI A SER FELIZ,1,2 days ago,DEAN - DIE 4 YOU (Official Visualizer)
799,"Omg, I might cry djdkdkdks after 4 years ㅠㅠ",0,4 days ago,DEAN - DIE 4 YOU (Official Visualizer)
800,i've missed you my dear DEAN.......,1,3 days ago,DEAN - DIE 4 YOU (Official Visualizer)
801,"이런 노래를 쓸 정도의 사랑을 해봤기에 지금의 Dean이 있는게 아닐까. 죽을만큼 고통스럽고, 대신 죽을 수도 있다는 마음이 들었던 사랑. 그 사랑의 끝. 그 정도의 고통인데도 다시 원할 정도의 사랑. 기다림 끝에 나온 노래가 이정도의 아픔을 담은 곡일지 몰랐지만 내가 왜 이토록 기다렸는지 보여주는 곡.",8,4 days ago,DEAN - DIE 4 YOU (Official Visualizer)
802,인정 ㅜㅜ,0,4 days ago,DEAN - DIE 4 YOU (Official Visualizer)
803,ㅈㄴ 오글거리네,0,3 days ago,DEAN - DIE 4 YOU (Official Visualizer)
804,Welcome back Angel ,1,21 hours ago,DEAN - DIE 4 YOU (Official Visualizer)
805,기다렸어요,0,3 days ago,DEAN - DIE 4 YOU (Official Visualizer)
806,"My dear, we missed u like u can't imagine ",1,3 days ago,DEAN - DIE 4 YOU (Official Visualizer)
807,흰수염 : 딘은 실존한다 !,0,4 days ago,DEAN - DIE 4 YOU (Official Visualizer)
808,He really said take this and shut up  we really pushed him to come back,0,4 days ago,DEAN - DIE 4 YOU (Official Visualizer)
809,드디어 다시 활동하시네요  ....ai는 갈수록 똑같아지네ㅋㅋㅋㅋㅋㅋ넘 그리웠네진짜루 ㅜㅜㅜㅜㅜㅜ!!!!!!,15,5 days ago (edited),DEAN - DIE 4 YOU (Official Visualizer)
810,어머나 ㅋㅋㅋㅋㅋㅋ,2,5 days ago,DEAN - DIE 4 YOU (Official Visualizer)
811,ai에서 현실세계로 돌아왔다 ㅜ,1,1 day ago,DEAN - DIE 4 YOU (Official Visualizer)
812,"RM has great taste, as always",2,4 days ago,DEAN - DIE 4 YOU (Official Visualizer)
813,I can't believe he's back!,0,4 days ago,DEAN - DIE 4 YOU (Official Visualizer)
814,OMG. THIS IS REAL. I thought it was another ai cover. ,0,4 days ago,DEAN - DIE 4 YOU (Official Visualizer)
815,We missed you,1,3 hours ago,DEAN - DIE 4 YOU (Official Visualizer)
816,この歌声が聴けて幸せです。Happy to hear your voice.Winter is coming again. I will spend it listening to this song.,14,5 days ago,DEAN - DIE 4 YOU (Official Visualizer)
817,He eats everytime I MISSED YOU BRO,0,3 days ago,DEAN - DIE 4 YOU (Official Visualizer)
818,Omg he’s BACK!! ,0,3 days ago,DEAN - DIE 4 YOU (Official Visualizer)
819,천재 아님 이런걸 만들수 있을까?,2,3 days ago,DEAN - DIE 4 YOU (Official Visualizer)
820,Vale a pena esperar por você Dean!,3,5 days ago,DEAN - DIE 4 YOU (Official Visualizer)
821,Yes finally I can keep on living,1,1 day ago,DEAN - DIE 4 YOU (Official Visualizer)
822,It’s like he never left,1,22 hours ago,DEAN - DIE 4 YOU (Official Visualizer)
823,음색 진짜 독보적이다,13,5 days ago,DEAN - DIE 4 YOU (Official Visualizer)
824,No way!!! COMEBACK time,1,3 days ago,DEAN - DIE 4 YOU (Official Visualizer)
825,YOU ARE FINALLY BACK AAAAAAAH,0,3 days ago,DEAN - DIE 4 YOU (Official Visualizer)
826,It's not too late and it's not too crazy  - we've been patiently waiting for you to come. Welcome back DEAN! I can finally breathe after listening to this 5 times. I'm convinced this as a comfort song from you to us. The lyrics feel like you're telling us directly the battle about making music that you love and want to share with us between your heart and brain. Thank you so much for creating this song as the first comeback. ,5,5 days ago (edited),DEAN - DIE 4 YOU (Official Visualizer)
827,스토리에 올린거 존나좋다 시빡,1,4 days ago,DEAN - DIE 4 YOU (Official Visualizer)
828,his music was mid at some point (in 2019(?)) but he came back with smth really nice.he probably was burnt out or smth. but it wasn’t giving at all.,0,4 days ago (edited),DEAN - DIE 4 YOU (Official Visualizer)
829,"dean never disappoint, I'm so happy for this comeback ",8,5 days ago,DEAN - DIE 4 YOU (Official Visualizer)
830,At least with a MV and a full documentary dude,1,4 days ago,DEAN - DIE 4 YOU (Official Visualizer)
831,Best song,0,1 day ago,DEAN - DIE 4 YOU (Official Visualizer)
832,"Thank you for presenting your heart in audio form. We’re so grateful you’re back, with vocals that feel like a vivid nebula of stars ",14,5 days ago,DEAN - DIE 4 YOU (Official Visualizer)
833,amazingggggg!!!!!!!!!!!!!!!!!!,1,2 days ago,DEAN - DIE 4 YOU (Official Visualizer)
834,OMG FINALLY ,1,22 hours ago,DEAN - DIE 4 YOU (Official Visualizer)
835,Dean is like the avatar he comes in kpop industry when we indeed him the most  to start drop amazing songs,14,5 days ago,DEAN - DIE 4 YOU (Official Visualizer)
836,omggg dean has only gone and done it againnn!! im so happy thats hes back and making such amazing music just like before. This WILL be on repeat for sure for sure.,14,5 days ago,DEAN - DIE 4 YOU (Official Visualizer)
837,I can’t believe that he’s back. This song gives me a peace that I can’t explain I’ll always be a fan of Dean because he is so talented and this song proves it once again  4:44,3,5 days ago,DEAN - DIE 4 YOU (Official Visualizer)
838,2:54 THE HARMONIES THEN THE BASS AUGHHIt tickles my brain so much,6,5 days ago,DEAN - DIE 4 YOU (Official Visualizer)
839,"Since Dean left 4 years ago, the world almost ended, my life went downhill and everything was going wrong. Now that he’s back I feel like everything will get back to how it once was. This Man is perfect and a wonderful artist. We all missed you",3,5 days ago,DEAN - DIE 4 YOU (Official Visualizer)
840,"Eu tenho a mesma sensação, é como se Dean fosse uma parte nossa, é de fato uma conexão",0,5 days ago,DEAN - DIE 4 YOU (Official Visualizer)
841,"I’ve been listening to this song on repeat, after all these years of waiting Dean didn’t let us down",7,5 days ago,DEAN - DIE 4 YOU (Official Visualizer)
842,Dean's music is like an empty cement room. Dean's voice is like smoke that fills up an empty room. You are always worth waiting for.,6,5 days ago,DEAN - DIE 4 YOU (Official Visualizer)
843,DIE 4 YOU is a masterpiece!! Thank you Dean! ️,6,5 days ago,DEAN - DIE 4 YOU (Official Visualizer)
844,cant believe its actually possible to miss an artist this much coz wth i almost cried hearing the first verse ,7,5 days ago,DEAN - DIE 4 YOU (Official Visualizer)
845,lol same hugs 🫶🥹,0,5 days ago,DEAN - DIE 4 YOU (Official Visualizer)
846,음색 대박이다 ㅜㅜㅜㅜㅜㅜ,4,5 days ago,DEAN - DIE 4 YOU (Official Visualizer)
847,역시…너무 좋다,52,5 days ago,DEAN - DIE 4 YOU (Official Visualizer)
848,노래가…미친 것 같아…너무 좋잖아…,30,5 days ago,DEAN - DIE 4 YOU (Official Visualizer)
849,AI가 아닌 진짜 딘 목소리를 다시 들을 수 있어서... 너무 감동 적이다..ㅜㅜ,11,5 days ago,DEAN - DIE 4 YOU (Official Visualizer)
850,everything this man makes is absolute perfection and he deserves everything in the world,4,5 days ago,DEAN - DIE 4 YOU (Official Visualizer)
851,"thank you, dean. I will be staring at the ceiling and crying to this song now ",6,5 days ago,DEAN - DIE 4 YOU (Official Visualizer)
852,"Even tho its been 4 years of silence from him, i'm so happy that i can just come bk and its like he never left. His music is something that just leaves a make on anyone that listening to it, and that real music, art. Its beautiful, soft and peaceful.",3,5 days ago,DEAN - DIE 4 YOU (Official Visualizer)
853,이 곡을 들을 수 있어서 정말 행복해요... 이런 곡이라면 당연히 또 몇 년이라도 기다릴 수 있지 이렇게 좋은데...,7,5 days ago,DEAN - DIE 4 YOU (Official Visualizer)
854,Definitely on repeat for 1000000 times ️‍,3,5 days ago,DEAN - DIE 4 YOU (Official Visualizer)
855,I’ve missed dean so much I’ve been praying for new music this song is unreal his voice is so beautiful and calming. I love you Dean 🫶,9,5 days ago (edited),DEAN - DIE 4 YOU (Official Visualizer)
856,약 4년동안 기다린 시간이 헛되지 않을 만큼 너무 좋네요... 많은 시간 동안 기다린 만큼 이번 곡이 저에게도 딘 님에게도 소중할 거라 생각해요 돌아와줘서 고마워요,5,5 days ago,DEAN - DIE 4 YOU (Official Visualizer)
857,I’ve never been that happy in my life to hear his voice,4,5 days ago,DEAN - DIE 4 YOU (Official Visualizer)
858,오랜만에 목소리 들으니까너무 좋다..,34,4 days ago,DEAN - DIE 4 YOU (Official Visualizer)
859,"OMG Our R&B King Dean is Finally Back!! This Song is So Beautiful, and Healing!! We Love you, Dean Never Disappoints!! ️‍",12,5 days ago,DEAN - DIE 4 YOU (Official Visualizer)
860,지금이 몇시든 새벽으로 만들어버리는 목소리... 정말 오래 기다렸어요,25,5 days ago,DEAN - DIE 4 YOU (Official Visualizer)
861,ㄹㅇ,0,5 days ago,DEAN - DIE 4 YOU (Official Visualizer)
862,"진짜 얼마나 기다렸는지 몰라.. ㅠㅠ 4,5년지나도 아직 모쏠이다 딘아 ㅋㅋㅋㅋㅋㅋㅋㅋㅋㅋ 역시 여전히 딘에 색깔로 가득한 음악, 가사 & 멜로디 하나하나 빠짐 없이 완벽했습니다!",39,5 days ago,DEAN - DIE 4 YOU (Official Visualizer)
863,딘아 ㅇㅈㄹ ㅋㅋ,4,5 days ago,DEAN - DIE 4 YOU (Official Visualizer)
864,"This time must have been hard for you. Many MANY trials and errors but you still didn't give up and gave us the highest quality. I hope from now on we will be able to take off all of the pressure from your shoulders and many happier days are going to come to your life! Thank you for your hard work, thank you for the courage, welcome back!",4,5 days ago,DEAN - DIE 4 YOU (Official Visualizer)
865,DEAN NEVER DISAPPOINTS.,4,5 days ago,DEAN - DIE 4 YOU (Official Visualizer)
866,This is my first time being happy because an artist is releasing his/her song. Missed his voice sm. I wanna cry too Im so happy for all of us who were patiently waiting for him and rooting for him!!!!,6,5 days ago,DEAN - DIE 4 YOU (Official Visualizer)
867,"There is nothing sweeter than Dean's voice <3, four years of waiting were worth it  welcom home dear 🫶",4,5 days ago,DEAN - DIE 4 YOU (Official Visualizer)
868,심금을 울리는 목소리.. 멈췄던 시간이 흐른다..,3,5 days ago,DEAN - DIE 4 YOU (Official Visualizer)
869,i can die happy now after hearing his voice again after so long,8,5 days ago,DEAN - DIE 4 YOU (Official Visualizer)
870,5년을 기다린 보람이 있는 노래다… 멜론 1등 기대하겠습니다 혁씨.!!,31,5 days ago (edited),DEAN - DIE 4 YOU (Official Visualizer)
871,사랑해요 딘! 당신의 음악은 나를 계속 움직이게 해요 ,7,5 days ago,DEAN - DIE 4 YOU (Official Visualizer)
872,와줘서 고맙다 진짜 기쁘다ㅠㅠㅠㅠ 역시 노래도 너어어어무 좋고.. 진짜 좋다,10,5 days ago,DEAN - DIE 4 YOU (Official Visualizer)
873,오늘 아침까지 곡 수정하면서 우리에게 좋은 곡을 들려줘서 고마워그리고 다시 세상 밖으로 나와줘서 너무 고마워,59,5 days ago,DEAN - DIE 4 YOU (Official Visualizer)
874,DEAN HAS COME TO BREATHE LIFE INTO THE MUSIC INDUSTRY !!!!!!! I'VE BEEN WAITING SOSO LONG FOR A COMEBACK AAAAAAAAAAA,5,5 days ago,DEAN - DIE 4 YOU (Official Visualizer)
875,노래 진짜 진짜 진짜...좋아요...더 표현하고 싶어도 그냥 이 말 말고는 더 좋은 말을 못찾겠어요,14,5 days ago,DEAN - DIE 4 YOU (Official Visualizer)
876,AI로 뉴진스 노래만 듣다가……. 진짜 목소리는 진심 너무 오랜만이다 사랑해 딘 꼭 다시 활동해주라… ㅠㅠㅠ 아니면 행복하고 살아있다고 알려줘  사랑합니다요,42,5 days ago,DEAN - DIE 4 YOU (Official Visualizer)
877,정말 오래 기다렸어요🥹 컴백해서 너무 행복하구 오랜만에 목소리 들으니까 너무 좋습니다...🩶🫶,14,5 days ago,DEAN - DIE 4 YOU (Official Visualizer)
878,정말 오래 기다렸어요. 이번 노래도 정말 좋네요. 그냥 와주셔서 감사해요..,28,5 days ago,DEAN - DIE 4 YOU (Official Visualizer)
879,개좋네요 진짜로... 그동안 왜 곡 안냈는지 의문이 들 정도로...,8,5 days ago,DEAN - DIE 4 YOU (Official Visualizer)
880,"Its crazy how that justhis featured song is supposed to be on the same album as this??? I have to seriously get my hands on this new album fr, this is art.",4,5 days ago,DEAN - DIE 4 YOU (Official Visualizer)
881,ai로 뭐라했지만 사실은 진짜의 기교와 분위기는 이길수 없다는걸 알고있었다...왜 이런 좋은실력인데 지금까지 돌아오지 않은걸까.,4,5 days ago,DEAN - DIE 4 YOU (Official Visualizer)
882,[Lyrics]I don't wanna go Till everything comes crashing down,22,5 days ago (edited),DEAN - DIE 4 YOU (Official Visualizer)
883,,0,5 days ago,DEAN - DIE 4 YOU (Official Visualizer)
884,Sobbing in my room because last time he came out with music life was completely different,4,5 days ago,DEAN - DIE 4 YOU (Official Visualizer)
885,1000%,0,5 days ago,DEAN - DIE 4 YOU (Official Visualizer)
886,REAL MUSIC AT ITS FINEST,17,5 days ago,DEAN - DIE 4 YOU (Official Visualizer)
887,This is beautiful ,0,5 days ago,DEAN - DIE 4 YOU (Official Visualizer)
888,I cherish this man’s artistry so highly.,11,5 days ago,DEAN - DIE 4 YOU (Official Visualizer)
889,FR,1,5 days ago,DEAN - DIE 4 YOU (Official Visualizer)
890,"people might not know how big is this, thank you Dean i’m so emotional rn ️‍🫶",8,5 days ago,DEAN - DIE 4 YOU (Official Visualizer)
891,확실히 딘만 나타낼 수 있는 특유의 보컬 감성이 있음 ,14,5 days ago,DEAN - DIE 4 YOU (Official Visualizer)
892,Dean has finally come back to us. This is amazing,3,5 days ago,DEAN - DIE 4 YOU (Official Visualizer)
893,this is the nth time listening to this song since it was released 30 minutes ago and the goosebumps and out of body experience everytime is surreal,6,5 days ago,DEAN - DIE 4 YOU (Official Visualizer)
894,4:44DIE 4 YOUDEAN,17,5 days ago,DEAN - DIE 4 YOU (Official Visualizer)
895,"Your video has become my virtual mentor, guiding me towards a better version of myself",2,5 days ago,DEAN - DIE 4 YOU (Official Visualizer)
896,"이래서 딘이지.. 1초1초가 다 너무 좋다..... 가사도 목소리도,, 모든게 다..  I love you,  I'll be loving you",11,5 days ago,DEAN - DIE 4 YOU (Official Visualizer)
897,I got goosebumps when I saw this come out ,4,5 days ago,DEAN - DIE 4 YOU (Official Visualizer)
898,"딘만 할 수 있는게 있다 여태 냈던 음악들은 모두 연결되어있고 매번 새로움이 있다 언제 음악이 나오든 권혁은 항상 발전한다, 그저 여태 냈던 노래들과 다를 바 없이 느낀다면 그냥 다른 가수 노래 들으면 됨",7,5 days ago,DEAN - DIE 4 YOU (Official Visualizer)
899,IM IN TEARS IM CRYING U HAVE NO IDEA HOW LONG IVE BEEN WAITING FOR THIS,14,5 days ago,DEAN - DIE 4 YOU (Official Visualizer)
900,아니 두눈 의심하면서 들어왔는데 목소리 진짜 녹아내린다,5,5 days ago,DEAN - DIE 4 YOU (Official Visualizer)
901,"goddamn, 4 years(?) since this man released his last song, and was it worth the wait! couldn't be happier!",5,5 days ago,DEAN - DIE 4 YOU (Official Visualizer)
902,"No puedo creer que lo conocí hace 6 años con Bermuda Triangle, me enamoré tanto de su música, su voz,  cuando dejó de hacer música pensé que no regresaría, estoy tan feliz y orgullosa de Dean, todo lo que logró solo y esta por lograr ",7,5 days ago (edited),DEAN - DIE 4 YOU (Official Visualizer)
903,"디테일에 엄청난 신경을 쓴 것이 들린다, 보인다, 떠오른다..음악이며, 사운드이며, 감성이며, 보컬로서의 활용도이며, 영상미이며.. 엄청난 준비를 해온 것 같고이게 이제 새로운 시작일 거니아무 불만 없이 기다릴게요..",3,5 days ago,DEAN - DIE 4 YOU (Official Visualizer)
904,2월 29일에 나올 거 같아여,0,5 days ago,DEAN - DIE 4 YOU (Official Visualizer)
905,I’ll be waiting for the album’s full release patiently,5,5 days ago,DEAN - DIE 4 YOU (Official Visualizer)
906,특유의 귀를 간지럽히는 사운드.. 너무 그리웠다 지금까지,4,5 days ago,DEAN - DIE 4 YOU (Official Visualizer)
907,듣고있는 이 소리가 AI 목소리가 아니라니..믿기지가 않아….ㅠㅠㅠㅠㅠ기다렸어 노래 너무 좋아ㅠㅠㅠㅠ,8,5 days ago,DEAN - DIE 4 YOU (Official Visualizer)
908,아 딘 진짜 기다리느라 죽는줄ㅠㅠㅠㅠ사랑해 딘!!!!!!,14,5 days ago,DEAN - DIE 4 YOU (Official Visualizer)
909,하 진짜 딘.....사랑합니다...,3,5 days ago,DEAN - DIE 4 YOU (Official Visualizer)
910,아 너무 좋네요 6년을 기다렸습니다..,23,5 days ago,DEAN - DIE 4 YOU (Official Visualizer)
911,눈물이. 멈추지않읍니다..,305,5 days ago,DEAN - DIE 4 YOU (Official Visualizer)
912,me too.....,2,5 days ago,DEAN - DIE 4 YOU (Official Visualizer)
913,ㅠㅠㅠㅠ,0,5 days ago,DEAN - DIE 4 YOU (Official Visualizer)
914,Me tooo!!!🥹,0,5 days ago,DEAN - DIE 4 YOU (Official Visualizer)
915,눈물이 주르르..,1,5 days ago,DEAN - DIE 4 YOU (Official Visualizer)
916,누굴 그렇게 그리워 하는구얌 ..  목소리 여전히 듣기 좋다,6,5 days ago,DEAN - DIE 4 YOU (Official Visualizer)
917,HE’S BACK TO SAVE 2023 ️,5,5 days ago,DEAN - DIE 4 YOU (Official Visualizer)
918,사랑해..정말 오래 기다렸어,196,5 days ago,DEAN - DIE 4 YOU (Official Visualizer)
919,DEAN WE MISSED YOU!!! I MISSED YOUR VOICE SO BADLY ,14,5 days ago,DEAN - DIE 4 YOU (Official Visualizer)
920,Absolutely ,0,5 days ago,DEAN - DIE 4 YOU (Official Visualizer)
921,아 너무 좋다… 사랑해,3,5 days ago,DEAN - DIE 4 YOU (Official Visualizer)
922,드디어 왔다!!! 오랫동안 기다렸어요!!! 컴백을 축하합니다!!! ,16,5 days ago,DEAN - DIE 4 YOU (Official Visualizer)
923,첫소절 듣자마자 걍 활짝 웃음 이거지…,3,5 days ago,DEAN - DIE 4 YOU (Official Visualizer)
924,딘은 신이다  ,4,5 days ago,DEAN - DIE 4 YOU (Official Visualizer)
925,단순히 이별한 연인을 그리워하는 노래처럼 보이기도 하지만 무언가음악인으로서의 완벽함과 자신의스타일을 추구하는 딘이 그동안담았던 고뇌를 푸는 것처럼 들리기도,10,5 days ago (edited),DEAN - DIE 4 YOU (Official Visualizer)
926,어떤 멜로디도 그 어떤 스토리도 내(권혁)겐 네(딘)의 잔상일 뿐인데-> 딘 속 가려지는 권혁으로도 해석을 해봤음,0,5 days ago,DEAN - DIE 4 YOU (Official Visualizer)
927,그럼에도 대중들이 사랑해주는 모습은권혁 그 사람 자체가 아니라 딘이니까그 속에서 오는 외로움과 성공 속에서권혁은 딘에게 너를 위해서라면 희생할 수 있다는 가사를 표현하고 싶었던게 아닐까.. 그냥 그렇게 생각해봤어,0,5 days ago,DEAN - DIE 4 YOU (Official Visualizer)
928,a.i 인줄 알고 신나게 달려왔다가 천국을 경험....딘님 살아계셨네요..,8,5 days ago,DEAN - DIE 4 YOU (Official Visualizer)
929,진짜 thank you for the 컴백 🫶,5,5 days ago,DEAN - DIE 4 YOU (Official Visualizer)
930,"can we just fill this room with thank you, thank you ",15,5 days ago,DEAN - DIE 4 YOU (Official Visualizer)
931,보컬로이딘 노래만 나와서 좀 슬펐는데 진짜 딘 노래 발매되니까 감격스럽다,6,5 days ago,DEAN - DIE 4 YOU (Official Visualizer)
932,와ㅏㅏㅏ 갓 딘!!!,4,5 days ago,DEAN - DIE 4 YOU (Official Visualizer)
933,미쳤다 미쳤어,3,5 days ago,DEAN - DIE 4 YOU (Official Visualizer)
934,이렇게까지 한 남자를 기다린 적은 처음인데.. 역시 기대를 져버리지 않는구나,11,5 days ago,DEAN - DIE 4 YOU (Official Visualizer)
935,"당신의 이야기를 듣고 밤하늘을 보니까 구름이 빨리 지나가는 오늘이네요. 하필 오늘. 돌아와줘서 너무 기뻐요. 딘,",19,5 days ago,DEAN - DIE 4 YOU (Official Visualizer)
936,아 진짜 딘ㅠㅠㅠㅠㅠ,3,5 days ago,DEAN - DIE 4 YOU (Official Visualizer)
