,comment,like,time,title_list
335,I celebrated before starting to listen to your new masterpiece  missed your art so much,1,2 days ago,DEAN - DIE 4 YOU (Official Visualizer)
336,damn i've missed his voice. welcome back DEAN,1,2 days ago,DEAN - DIE 4 YOU (Official Visualizer)
337,"Dean already serving visual, vocal, and presence in his appearance just proved how talented he is.",85,5 days ago,DEAN - DIE 4 YOU (Official Visualizer)
338,Love it ,0,4 days ago,DEAN - DIE 4 YOU (Official Visualizer)
339,i started crying as soon as i heard his voice,1,4 days ago,DEAN - DIE 4 YOU (Official Visualizer)
340,So freaking good been waiting so long for new music from you so happy🫶,1,3 days ago,DEAN - DIE 4 YOU (Official Visualizer)
341,역시 기대를 저버리지 않는다!! 오랜만에 보는 건데도 반가운 것보다 노래가 너무 좋단 생각만 듦 ㅎㅎ,4,3 days ago,DEAN - DIE 4 YOU (Official Visualizer)
342,"DEAN MI REY, AMOR DE MI VIDA️️‍",1,3 days ago,DEAN - DIE 4 YOU (Official Visualizer)
343,그 어떤 말도 떠오르지않는다.. 그냥 좋다.... 컴백해줘서 정말 고마워요 딘!!!!ㅠㅠㅠㅠ,105,5 days ago,DEAN - DIE 4 YOU (Official Visualizer)
344,Waiting for a long time ! Welcome back!DEAN Love ur music so much !Sending love from Taiwan 🇹🇼,0,4 days ago (edited),DEAN - DIE 4 YOU (Official Visualizer)
345,Ayyyyy por fiiiiin  le rogué a todos los santos para que sigas sacando música ,0,3 days ago,DEAN - DIE 4 YOU (Official Visualizer)
346,beautiful song ,1,3 days ago,DEAN - DIE 4 YOU (Official Visualizer)
347,"Te extrañé demasiado, Dean. ♡",0,4 days ago,DEAN - DIE 4 YOU (Official Visualizer)
348,진짜 너무 좋아요 진짜 대박,1,9 hours ago,DEAN - DIE 4 YOU (Official Visualizer)
349,"actually throwing up tears this song has me ascending, you never fail to make the most incredible music to grace this planet. Going almost 9 years strong and i don't see an end in sight, you're one of my most favourite artists and the day i see you perform will be marked as one of the most greatest and spiritual moments of my life. LYSM DEAN <3333",76,5 days ago,DEAN - DIE 4 YOU (Official Visualizer)
350,딘의 목소리는 진심이다...,0,2 days ago,DEAN - DIE 4 YOU (Official Visualizer)
351,Espectacular canción ,0,3 days ago,DEAN - DIE 4 YOU (Official Visualizer)
352,Masterpiece,1,4 days ago,DEAN - DIE 4 YOU (Official Visualizer)
353,THIS IS SO GOOD,1,4 days ago,DEAN - DIE 4 YOU (Official Visualizer)
354,DEAN VOLTOOOOO CARALHOOOOOOOOOOOOOOOOOO,0,4 days ago,DEAN - DIE 4 YOU (Official Visualizer)
355,7 years of loving you - we're still here and we adore you! Another DEAN masterpiece ♡,58,5 days ago,DEAN - DIE 4 YOU (Official Visualizer)
356,"Damn.....it's like he never left usIts like a laying in the most chill spot I've ever been to, while being in love and ish",1,3 days ago (edited),DEAN - DIE 4 YOU (Official Visualizer)
357,AMAZING VOICE,1,3 days ago,DEAN - DIE 4 YOU (Official Visualizer)
358,"Dang, Nice voice",2,13 hours ago,DEAN - DIE 4 YOU (Official Visualizer)
359,Who hurt ma boy and he wrote that masterpiece? Welcome back DEAN,0,4 days ago,DEAN - DIE 4 YOU (Official Visualizer)
360,VSFD ELE SOME POR 4 ANOS E VOLTA COM UM TAPA NA MINHA CARA COM ESSA MUSICA PLMDS Q MUSICA PERFEITA,0,3 days ago,DEAN - DIE 4 YOU (Official Visualizer)
361,"Estoy tan agradecida con la vida de que hayas nacido. Gracias por existir, Dean ",37,5 days ago,DEAN - DIE 4 YOU (Official Visualizer)
362,,0,5 days ago,DEAN - DIE 4 YOU (Official Visualizer)
363,From the 1st 3 seconds i knew it was perfect...,1,4 days ago,DEAN - DIE 4 YOU (Official Visualizer)
364,Glad to hear this gem ,0,4 days ago,DEAN - DIE 4 YOU (Official Visualizer)
365,"BRUHHHHHH , HOW I MISS HIS VOICE SO DAMN MUCHHHHH",1,3 days ago,DEAN - DIE 4 YOU (Official Visualizer)
366,"I WAS WAITING FOR THIS SO MANY YEARS, WELCOME BACK",1,23 hours ago,DEAN - DIE 4 YOU (Official Visualizer)
367,MASTERPIECE THE KING IS BACK !,0,2 days ago,DEAN - DIE 4 YOU (Official Visualizer)
368,"You never stop surprising us with your beautiful talent, thank you for existing Dean.",64,5 days ago,DEAN - DIE 4 YOU (Official Visualizer)
369,Now please give us an album consisting of 20 tracks. 🫶,0,4 days ago,DEAN - DIE 4 YOU (Official Visualizer)
370,MANNN THIS IS SO GOOD,0,4 days ago,DEAN - DIE 4 YOU (Official Visualizer)
371,"I hope you're doing well in life dean, take care of your mental health and body, thanks for this wonderful music, but bruh, you mf pls drop a fvcking album!!!!",0,4 days ago,DEAN - DIE 4 YOU (Official Visualizer)
372,"Why am I crying both happy and sad tears?   DEEEEEEEEEEEEEAN! WELCOME BACK, SON! STAY FOR AWHILE!!!!!",1,7 hours ago,DEAN - DIE 4 YOU (Official Visualizer)
373,FINALMETE DEAN AAAAAAAAAAAA MUSICA NOVA,2,2 days ago,DEAN - DIE 4 YOU (Official Visualizer)
374,"Es una canción tan hermosa y su voz es la mejor, Dean volvió con todo <3",14,5 days ago,DEAN - DIE 4 YOU (Official Visualizer)
375,Amo tu nueva canción ,1,3 days ago,DEAN - DIE 4 YOU (Official Visualizer)
376,I swear it’s like dean’s voice knows the beat and the beat knows his voice.,0,3 days ago,DEAN - DIE 4 YOU (Official Visualizer)
377,Thank you Dean 🫶this song is so ️,0,2 days ago,DEAN - DIE 4 YOU (Official Visualizer)
378,언제나 그랬듯 이번 곡도 너무 좋다..,0,4 days ago,DEAN - DIE 4 YOU (Official Visualizer)
379,I was just thinking about him and his voice. Good to hear something new. Soothing,0,3 days ago,DEAN - DIE 4 YOU (Official Visualizer)
380,00:01 Yo: AMO ESTA CANCIÓN! ,7,5 days ago,DEAN - DIE 4 YOU (Official Visualizer)
381,Glad i stumble upon this late at night. Didn't know he release this. Hopefully there's more,1,9 hours ago,DEAN - DIE 4 YOU (Official Visualizer)
382,Eu nem acredito que esse dia realmente chegou ️‍,25,2 days ago,DEAN - DIE 4 YOU (Official Visualizer)
383,Foi muito tempo de espera amg,0,20 hours ago,DEAN - DIE 4 YOU (Official Visualizer)
384,THANK YOU FOR COMING BACK KING,1,12 hours ago,DEAN - DIE 4 YOU (Official Visualizer)
385,New releases in the industry were good but NONE hit me as much as this one. DEAN has a gift and I am so happy he is back with a track.,3,2 days ago,DEAN - DIE 4 YOU (Official Visualizer)
386,"HERMANAS LA ESPERA VALIO LA PENA, TOTALMENTE",2,3 days ago (edited),DEAN - DIE 4 YOU (Official Visualizer)
387,Siiii ,0,3 days ago,DEAN - DIE 4 YOU (Official Visualizer)
388,"I want you to know that the AI covers can never come close to the majesty of your voice, Dean. You are one of the best vocalists out there, you have been there for me even though you dont know it, you helped me so much mentally and I truly am the happiest at this moment. Please remember that we are always here for you and for your releases!",17,5 days ago,DEAN - DIE 4 YOU (Official Visualizer)
389,딘형 .. 노래너무 좋아...,3,1 day ago,DEAN - DIE 4 YOU (Official Visualizer)
390,So fricking good ,0,4 days ago,DEAN - DIE 4 YOU (Official Visualizer)
391,this is so melancholic yet beautiful. How have been dean?,0,3 days ago,DEAN - DIE 4 YOU (Official Visualizer)
392,Dean ain't ever dissapoint everyone needs to listen to my man fr,0,4 days ago,DEAN - DIE 4 YOU (Official Visualizer)
393,Miss you love you dean perfect as always,1,3 days ago,DEAN - DIE 4 YOU (Official Visualizer)
394,뭔가 심장이 조연히 뛰고 계속 듣게되네요..이날을 진심 기다렸다. 노래내줘서 감사해요 딘님.,33,5 days ago,DEAN - DIE 4 YOU (Official Visualizer)
395,A vuelto el Rey soy la persona más feliz del mundo en este momento️,0,4 days ago,DEAN - DIE 4 YOU (Official Visualizer)
396,How much i miss his sweet  vocals ,1,3 days ago,DEAN - DIE 4 YOU (Official Visualizer)
397,"I was introduced to Dean from my ex sharing me the song (Half Moon) now everytime I hear his songs it reminds me of her. Hope you are well and happy no matter where you are, I'll be loving you.",0,2 days ago,DEAN - DIE 4 YOU (Official Visualizer)
398,You and your music were dearly missed. Thank you for coming back.,1,3 days ago,DEAN - DIE 4 YOU (Official Visualizer)
399,"Thanks for your return, it feels good to hear you again",0,4 days ago,DEAN - DIE 4 YOU (Official Visualizer)
400,"dean's song always heals me, its selfish but im happy enough that you're willing to share these masterpieces with us ",22,5 days ago,DEAN - DIE 4 YOU (Official Visualizer)
401,I LOVE THIS!! DEAN IS BACKK <3,0,1 day ago,DEAN - DIE 4 YOU (Official Visualizer)
402,넘좋다 ......,1,8 hours ago,DEAN - DIE 4 YOU (Official Visualizer)
403,woo really good music to listen at the end of the yearrrr,0,1 day ago,DEAN - DIE 4 YOU (Official Visualizer)
404,you healed my heart again ️️,1,10 hours ago,DEAN - DIE 4 YOU (Official Visualizer)
405,Ah Masterpiece...... I was waiting for his comeback....I'll be waiting for more great song bro~,0,2 days ago,DEAN - DIE 4 YOU (Official Visualizer)
406,미쳤다 역시 미쳤다 너무 좋다~ 딘 노래를 들으면 세이렌이 생각남. 먼 발치에서 들리는 노래를 따라가다보면 나도 모르게 흠뻑 빠진채로 홀려버림 ... 이번 앨범 대박나서 활동 많이 해주세요 제발여,61,5 days ago,DEAN - DIE 4 YOU (Official Visualizer)
407,딘 넘 기다린 앨범이네요나의 영원한 아티스트 ,85,4 days ago,DEAN - DIE 4 YOU (Official Visualizer)
408,앨범이 아니라 싱글아닌가요?,2,3 days ago,DEAN - DIE 4 YOU (Official Visualizer)
409,hes on another level. just untouchable,1,2 days ago,DEAN - DIE 4 YOU (Official Visualizer)
410,Fr 🥹,1,1 day ago,DEAN - DIE 4 YOU (Official Visualizer)
411,Give us New album for going to another universe 🫴Just a single doesn’t enough Bruhh!,0,4 days ago,DEAN - DIE 4 YOU (Official Visualizer)
412,[Verse 1]I don't wanna go'Til everything comes crashin' downYou're the one I want,0,3 days ago,DEAN - DIE 4 YOU (Official Visualizer)
413,i miss you dean and your music! welcome back it feels like ur talking to me thru this song after ur long hiatus.,1,8 hours ago,DEAN - DIE 4 YOU (Official Visualizer)
414,넘모 좋아... 7년전인가 뉴욕에서 클럽 콘서트 할때 딘 보겠다고 5시간 버스타고 혼자 갔었는데 아직도 그때 추억 곱씹으면서 살아요.. ㅠㅠ 형 돌아와줘서 고마오..,52,5 days ago,DEAN - DIE 4 YOU (Official Visualizer)
415,돌아와주셨군요 …기다려왔어요 이 순간을..  노래 잘 듣겠습니다 항상 좋은 음악 들려줘서 고맙습니다 응원해요,0,3 days ago,DEAN - DIE 4 YOU (Official Visualizer)
416,딘은 계속 음악해야된다,0,4 days ago,DEAN - DIE 4 YOU (Official Visualizer)
417,"I was in highschool when he left, now college is done. Time flies",1,23 hours ago,DEAN - DIE 4 YOU (Official Visualizer)
418,딘 노래 들을 수 있는 삶에 감사합니다,4,3 days ago,DEAN - DIE 4 YOU (Official Visualizer)
419,the second i heard his voice i got butterflies,0,3 days ago,DEAN - DIE 4 YOU (Official Visualizer)
420,꿈속에있는것만 같다...매번 댄스챌린지. 릴스용 노래 지겹도록 듣다 지친 귀에 꽂힌 한줄기 빛..오롯이 목소리에 집중할수 있어서 더 좋아요 ,68,5 days ago,DEAN - DIE 4 YOU (Official Visualizer)
421,DEAN IS FINALLY BACK!!! ,0,4 days ago,DEAN - DIE 4 YOU (Official Visualizer)
422,THANK GOODNESS DEAN IS BACK!!!!!!!,0,4 days ago,DEAN - DIE 4 YOU (Official Visualizer)
423,So so grateful that he’s coming back ,0,4 days ago,DEAN - DIE 4 YOU (Official Visualizer)
424,Just love it,1,3 days ago,DEAN - DIE 4 YOU (Official Visualizer)
425,bro has officially risen from the dead and has not disappointed ,0,4 days ago,DEAN - DIE 4 YOU (Official Visualizer)
426,"딘 목소리도 넘 좋은데, 멜로디도 가사도 너무 좋아요. 귀가 녹는다️️️",126,5 days ago,DEAN - DIE 4 YOU (Official Visualizer)
427,Hope he's doing much better ,0,4 days ago,DEAN - DIE 4 YOU (Official Visualizer)
428,딘님 환영합니다 음악 들려주셔서 고맙습니다.,108,4 days ago,DEAN - DIE 4 YOU (Official Visualizer)
429,Always perfection with DEAN.For some reason I pictured J. Cole coming in on the second half of this song.,0,4 days ago,DEAN - DIE 4 YOU (Official Visualizer)
430,O DEAN SIMPLESMENTE ,0,2 days ago,DEAN - DIE 4 YOU (Official Visualizer)
431,Iam not even counting how many days till this thing happen.. Do whatever.. As long as u wish.. With all those AI DEAN shit that i also listen its still the best feeling i felt when i hear your voice. Finally not AI.,1,2 days ago,DEAN - DIE 4 YOU (Official Visualizer)
432,"Uau, ele voltou, e voltou com tudo! Que música incrível, essa melodia com as batidas, a letra, a voz do Dean. Nossa, está impecável, simplesmente tá melhor do que eu imaginei.",40,5 days ago,DEAN - DIE 4 YOU (Official Visualizer)
433,"Con tu permiso, le voy a hacer cover en español ",0,3 days ago,DEAN - DIE 4 YOU (Official Visualizer)
434,Can’t stop listening to,0,4 days ago,DEAN - DIE 4 YOU (Official Visualizer)
435,"I was just thinking about DEAN!!!  The grin on my face right now listening to this Heavenly track, like he never left!!",0,4 days ago,DEAN - DIE 4 YOU (Official Visualizer)
436,dean came back and decided to continue his GOAT era,2,3 days ago,DEAN - DIE 4 YOU (Official Visualizer)
437,"After a long time, you came back DEAN .",2,2 days ago,DEAN - DIE 4 YOU (Official Visualizer)
438,진짜로 왔구나… 목소리 다시 들으니까 실감난다… ㅠㅠㅠㅠㅠ 너무너무 보고싶었어 음악 실력은 여전하구나  딘아 뭐든 좋으니까 뭐든지 내줘 ㅠㅠㅠㅠ 🥹🥹🥹🥹🥹 4년이라니…,184,5 days ago (edited),DEAN - DIE 4 YOU (Official Visualizer)
439,Osvaldo Aritonang?Tanisha T Sadewo?Thank you so so much for helping dean composing this beautiful song,0,4 days ago,DEAN - DIE 4 YOU (Official Visualizer)
440,saur good never dissapoints always deliver ate slayed,1,4 hours ago,DEAN - DIE 4 YOU (Official Visualizer)
441,무친!! 무치이인!! 내 눈을 의심함! 또 새로운 AI 인가? 했는데 오피셜이누 ㅋㅋㅋㅋ 감사합니다..감사합니다...감사합니다아앜 ㅠㅠ!!! 딘 감 안죽었네 아직 솨라있네 클라스 영원하네에엨,1,12 hours ago,DEAN - DIE 4 YOU (Official Visualizer)
442,Absolutely epic.,0,3 days ago,DEAN - DIE 4 YOU (Official Visualizer)
443,this is soooo good huhu,0,4 days ago,DEAN - DIE 4 YOU (Official Visualizer)
444,"Thank you Dean for giving us this art. Now I can say that I can end the year in the most beautiful way thanks to you. I'm happy you're back. Dean you are art, your art makes my life have colors. Thanks for your music and thanks for coming back. I missed you️",48,5 days ago,DEAN - DIE 4 YOU (Official Visualizer)
445,holy crap after four years...song is amazing,0,4 days ago,DEAN - DIE 4 YOU (Official Visualizer)
446,another masterpiece,0,2 days ago,DEAN - DIE 4 YOU (Official Visualizer)
447,ay me se me bajó la presión como que volvió Dean,1,1 day ago,DEAN - DIE 4 YOU (Official Visualizer)
448,DEAN BABE I AM SO HAPPY YOUR RELEASING NEW MUSICE AGAIN THIS SONG ON REPEATTT,1,3 days ago,DEAN - DIE 4 YOU (Official Visualizer)
449,Porfin está devueltaaaaaa ,0,3 days ago,DEAN - DIE 4 YOU (Official Visualizer)
450,딘의 목소리는 진짜 국보로 지정해야한다,40,5 days ago,DEAN - DIE 4 YOU (Official Visualizer)
451,DEAN X GALDIVE IS NOT WHAT I COULD'VE IMAGINED BUT I LOVE IT SO MUCH 🫶🫶,0,3 days ago,DEAN - DIE 4 YOU (Official Visualizer)
452,"welcome back dean, we have missed you",1,1 day ago,DEAN - DIE 4 YOU (Official Visualizer)
453,This song speaks to me,2,1 day ago,DEAN - DIE 4 YOU (Official Visualizer)
454,Oh how much I missed him,2,2 days ago,DEAN - DIE 4 YOU (Official Visualizer)
455,Te amo mucho DEAN :D,1,1 day ago,DEAN - DIE 4 YOU (Official Visualizer)
456,Grité cuando escuché la primera línea. Extrañaba tanto oírlo cantar. Esperamos mucho y valió cada segundo. God Dean is back!!!,17,5 days ago,DEAN - DIE 4 YOU (Official Visualizer)
457,I need an album,2,19 hours ago,DEAN - DIE 4 YOU (Official Visualizer)
458,So beautiful; gorgeous 🩷🩷 I missed him so much ,0,4 days ago,DEAN - DIE 4 YOU (Official Visualizer)
459,"I've waited for so long, it feels like drinking water in a drought.",1,3 days ago,DEAN - DIE 4 YOU (Official Visualizer)
460,"딘님 잘 지내셨는지요,, 언제나 좋은 음악 감사합니다",0,4 days ago,DEAN - DIE 4 YOU (Official Visualizer)
461,You know what this means riight? That Dean is finally able to walk down the stairs of his house without falling down.,1,2 days ago,DEAN - DIE 4 YOU (Official Visualizer)
462,now why you mention that again? he just come back ,1,2 days ago,DEAN - DIE 4 YOU (Official Visualizer)
463,I absolutely love this man’s music and now that he just drops this out of the blue and it hits this hard is unbelievable. Truly great music ,6,5 days ago,DEAN - DIE 4 YOU (Official Visualizer)
464,"Dean, we missed you so so much 🫶",0,4 days ago,DEAN - DIE 4 YOU (Official Visualizer)
465,AAAAAAAAAAA WELCOME BACK DEAN,1,2 days ago,DEAN - DIE 4 YOU (Official Visualizer)
466,OUR BOY IS BACK,0,4 days ago,DEAN - DIE 4 YOU (Official Visualizer)
467,Dean if you're reading this we love the song,1,3 days ago,DEAN - DIE 4 YOU (Official Visualizer)
468,so good!,1,3 days ago,DEAN - DIE 4 YOU (Official Visualizer)
469,"A TOTAL MASTERPIECE. I still can't believe he's back and im literally crying rn. Been waiting for you years and im so so grateful you're back. your music has always been my favourite and will always be. I love this song so much, i love your music and i love you dean.",30,5 days ago,DEAN - DIE 4 YOU (Official Visualizer)
470,앞으로 더 자주 볼 수 있길 바라요 ️,0,4 days ago,DEAN - DIE 4 YOU (Official Visualizer)
471,OMMGGGG with surround headset this song is even more heavenlyyyyyyyyyyyyy,1,4 days ago,DEAN - DIE 4 YOU (Official Visualizer)
472,어디서 봤는데 너무 칭찬하지도 말고 너무 뭐라 하지도 마  너무 칭찬하면 부담스러워서 5~7년 정도 기다려야 할 수도 있고 너무 뭐라고 하면 앞으로 앨범은 없다다들 명심해라ㅠㅠㅠㅠㅠㅠㅠ,3,4 days ago (edited),DEAN - DIE 4 YOU (Official Visualizer)
473,기다린만큼 너무좋아ㅠㅠ,2,10 hours ago,DEAN - DIE 4 YOU (Official Visualizer)
474,Hermoso viaje! ,1,3 days ago,DEAN - DIE 4 YOU (Official Visualizer)
475,"Me siento volando después de años, lo extrañé demasiado, este comeback simplemente es perfecto como todos los demás, este va a ser muy especial y lo sé, lo amo tanto, te amo dean, te amo DIE 4 YOU ♡♡♡♡♡♡♡♡♡♡♡♡♡♡♡♡",9,5 days ago,DEAN - DIE 4 YOU (Official Visualizer)
476,صوتوووو رهيب,0,4 days ago,DEAN - DIE 4 YOU (Official Visualizer)
477,everything its so perfect and amazing,1,1 day ago,DEAN - DIE 4 YOU (Official Visualizer)
478,돌아와 주셔서 너무 감사해요 드디어 딘 ai가 아닌 딘 본체라니 ㅜㅜㅜㅜ 잘 들을께요 딘 화이팅 ️,0,4 days ago,DEAN - DIE 4 YOU (Official Visualizer)
479,I deadass gotta stop myself from commenting again cuz holy shit I am in love with this song right now,0,1 day ago,DEAN - DIE 4 YOU (Official Visualizer)
480,Thanks for comeback you saved my life Dean,1,2 days ago,DEAN - DIE 4 YOU (Official Visualizer)
481,앞으로 나올 앨범들 성적 연연해하지말고 그냥 딘의 음색과 음악성만 보여주면 된다. 딘 컴백곡이라는것 만으로도 성적은 어느정도 나온다. 틱톡 릴스 같은 플랫폼 유행 맞춰갈 필요도 없음. 노래만 좋으면 새로운 트렌드는 자연스레 생기기 마련… 그리고 일단 이 노래 개좋음,16,5 days ago,DEAN - DIE 4 YOU (Official Visualizer)
482,"True, the one and only Dean",0,5 days ago,DEAN - DIE 4 YOU (Official Visualizer)
483,사랑합느드  오래오래 건강히 음악활동 해주요,2,2 days ago,DEAN - DIE 4 YOU (Official Visualizer)
484,Gracias por volver,1,1 day ago,DEAN - DIE 4 YOU (Official Visualizer)
485,"Came for galdive, stayed for Dean",1,2 days ago,DEAN - DIE 4 YOU (Official Visualizer)
486,"Dean, thanks for coming back.We missed you",0,1 day ago,DEAN - DIE 4 YOU (Official Visualizer)
487,Damn......you knew we needed this didn't you🥹,1,3 days ago,DEAN - DIE 4 YOU (Official Visualizer)
488,DEAN i love you! i appreciate you for blessing us with your voice and talent. youre one of the reasons why i listen to music  you can't handle FANXYCHILD! ,22,5 days ago,DEAN - DIE 4 YOU (Official Visualizer)
489,Gracias por volver Oppa  I love You  Te amo  🫶,1,3 days ago,DEAN - DIE 4 YOU (Official Visualizer)
490,진찐가요? 딘만의 프레이즈~ 그 호흡 너무 반갑고 또 고마워요,0,4 days ago (edited),DEAN - DIE 4 YOU (Official Visualizer)
491,이번 커버도 좋네요 딘철인형 딘파고님 어쩜 이리 딘 목소리를 잘 구현해 냈는지 딘이 살아 돌아온 것만 같아요,0,4 days ago,DEAN - DIE 4 YOU (Official Visualizer)
492,"""Could you kill me once again"" hits hard",0,4 days ago,DEAN - DIE 4 YOU (Official Visualizer)
493,너무 좋다…,0,4 days ago,DEAN - DIE 4 YOU (Official Visualizer)
494,"딘 컴백 시작, 존나 크게 시작, 컴백 존나 빵빠레 불면서 시작, 컴백 축제 시작, 컴백 클럽 오픈, 컴백 클럽 할인 이벤트 시작, 블랙컴백데이 이벤트 시작, 컴백 페스티벌 시작, 컴백 군악대 입장, 컴백 입학, 컴백 졸업 및 재입학, 컴백 복학, 컴백 파티 시작, 컴백의 저주 시작, 컴백의 악마 등장",231,5 days ago,DEAN - DIE 4 YOU (Official Visualizer)
495,솔직히 곡 별로임ㅇ,0,5 days ago,DEAN - DIE 4 YOU (Official Visualizer)
496, @99n99 그냥 좀 들어줘 별로라고하면 딘 또 잠수탄단 말이야....,25,5 days ago,DEAN - DIE 4 YOU (Official Visualizer)
497, @99n99   그래도 음색 좋잖아....... 걍 듣자,5,5 days ago,DEAN - DIE 4 YOU (Official Visualizer)
498,노래 존나 좋은데?,8,5 days ago,DEAN - DIE 4 YOU (Official Visualizer)
499, @99n99 딘은 그걸 노린거야기대감 낮춰놓고 개쩌는 곡 던져줄듯,2,5 days ago,DEAN - DIE 4 YOU (Official Visualizer)
500, @99n99  애피타이저라는 생각은 못하지?,0,5 days ago,DEAN - DIE 4 YOU (Official Visualizer)
501,노래 뒤지게좋네 ㄷㄷ,1,2 days ago,DEAN - DIE 4 YOU (Official Visualizer)
502,딘 돌아와줘서 고마워요 기다리고 있었어요 🥹,0,4 days ago,DEAN - DIE 4 YOU (Official Visualizer)
503,OMG YOU CAME BACK FINALLY ️,0,4 days ago,DEAN - DIE 4 YOU (Official Visualizer)
504,16년에 딘 한창 지방 클럽 행사 다닐때 딘 보려고 천안 갔다가 인파에 무대 모서리에 정강이 박아서 개큰 흉터 남았음 권혁 당신은 평생 못잊으니까 평생 하고싶은 음악 해주세요 ㅎㅎㅎ,0,3 days ago (edited),DEAN - DIE 4 YOU (Official Visualizer)
505,DEAN I WAS WAITING FOR U FOR 4 YRS THANK YOU FOR COMING BACK ,0,2 days ago (edited),DEAN - DIE 4 YOU (Official Visualizer)
506,좋아서 죽을 것 같다역시 딘이다. 이런음악하는 건 딘뿐이기때문에 팬하는거다,162,5 days ago,DEAN - DIE 4 YOU (Official Visualizer)
507,오바는 ㅋㅋㅋㅋ 10년전에도 나올법한 그저 그런음악,2,5 days ago,DEAN - DIE 4 YOU (Official Visualizer)
508,I’m soooooo happy DEAN is back ,0,3 days ago,DEAN - DIE 4 YOU (Official Visualizer)
509,So good!,0,3 days ago,DEAN - DIE 4 YOU (Official Visualizer)
510,우리 혁이오라버니 아껴주시고성원해주시고후원해주시고,69,4 days ago (edited),DEAN - DIE 4 YOU (Official Visualizer)
511,maan ..... hope universe taking care of you and your precious voice ️,0,4 days ago,DEAN - DIE 4 YOU (Official Visualizer)
512,독보적이다 진짜,1,17 hours ago,DEAN - DIE 4 YOU (Official Visualizer)
513,"crying dean is finally back, i love it when artists grow with the audience. love you dean and im happy you trusted us to come back.",55,5 days ago,DEAN - DIE 4 YOU (Official Visualizer)
514,I'm not delusional enough or that much in love (yet?) to die for anyone lol but the way I've only been singing and listening to this song someone might think differently,0,4 days ago,DEAN - DIE 4 YOU (Official Visualizer)
515,Espere por esto!!!,1,4 days ago,DEAN - DIE 4 YOU (Official Visualizer)
516,THE KING IS BACK,1,2 days ago,DEAN - DIE 4 YOU (Official Visualizer)
517,I waited 100 years and I'm not disappointed,2,3 days ago (edited),DEAN - DIE 4 YOU (Official Visualizer)
518,Omgddd this is soooooooo good. So beuuuuutiful. Thank you so much for coming back. Love yoy,1,1 day ago,DEAN - DIE 4 YOU (Official Visualizer)
519,DEANさんにしか出せないこの雰囲気が本当に大好き,7,5 days ago,DEAN - DIE 4 YOU (Official Visualizer)
520,DEAN TE AMO MUCHO ️‍,0,3 days ago,DEAN - DIE 4 YOU (Official Visualizer)
521,TE AMO MUCHO MI REY,1,3 days ago,DEAN - DIE 4 YOU (Official Visualizer)
522,OMG HE'S BACK FINALLY,1,3 days ago,DEAN - DIE 4 YOU (Official Visualizer)
523,"Finally, masterpiece coming",1,1 day ago,DEAN - DIE 4 YOU (Official Visualizer)
524,Omg Deans back! Im crying happy tears🥹️,1,3 days ago,DEAN - DIE 4 YOU (Official Visualizer)
525,드디어 돌아오셨다 알앤비의 왕 컴백해줘서 고마워요 덕분에 오랜만에 귀가 행복하네요 🫶 우리 혁님 항상 행복하기를,110,5 days ago,DEAN - DIE 4 YOU (Official Visualizer)
526,He's back  I'm SO HAPPY HES BACK,0,4 days ago,DEAN - DIE 4 YOU (Official Visualizer)
527,내가 좋아했던 너와의 이야기 같다넌 떠났지만 난 기다린다만질 수도 없고 볼 수도 없는잊어야 하지만 잊히지 않는 ,4,12 hours ago,DEAN - DIE 4 YOU (Official Visualizer)
528,DEAN le retour carrément!!,1,4 days ago,DEAN - DIE 4 YOU (Official Visualizer)
529,Great collab with Indonesia's musician Galdive! I've known Osvaldorio since winning a music show with Monostereo!,0,1 day ago,DEAN - DIE 4 YOU (Official Visualizer)
