,comment,like,time,title_list
530,My man really saying that he is coming back to save the industry,0,3 days ago,DEAN - DIE 4 YOU (Official Visualizer)
531,중학생때 딘 노래를 처음 듣고 충격적으로 좋아서 보니앤클라이드 가사 프린트해서 책가방에 들고 다닐정도로 좋아하고 앨범 미친듯이 들었어요ㅜㅜ근데 벌써 성인이 되었어요!!새 음악 내주셔서 너무 감사하고 앞으로 좋은 노래 오래오래 내주셨으면 좋겠어요,89,5 days ago,DEAN - DIE 4 YOU (Official Visualizer)
532,혁아 사랑해목소리 들을 수 있는것만으로도 너무 좋다,0,3 days ago,DEAN - DIE 4 YOU (Official Visualizer)
533,divoooo saudadeessssss come to brasil!!!!!,0,37 minutes ago,DEAN - DIE 4 YOU (Official Visualizer)
534,"FINALLY MY MAN, CRYING IN EVERY LANGUAGE ",0,4 days ago (edited),DEAN - DIE 4 YOU (Official Visualizer)
535,Truly Artist.,0,3 days ago,DEAN - DIE 4 YOU (Official Visualizer)
536,와 목소리 너무 반갑다,1,4 days ago,DEAN - DIE 4 YOU (Official Visualizer)
537,권혁!!고마워요 노래 내줘서 AI가 쏘아올린 작은공…너무 기다렸고 그리웠어요. 노래를 할 수있다는 것만으로도 너무 좋아요앞으로도 그 목소리와 호소력으로 듣는이를 즐겁게 해주세요!,125,5 days ago,DEAN - DIE 4 YOU (Official Visualizer)
538,너무좋아요 ,0,3 days ago,DEAN - DIE 4 YOU (Official Visualizer)
539,bro said this is what you call a comeback lmaoo i thought you gone sir  thank youuuu,1,4 days ago,DEAN - DIE 4 YOU (Official Visualizer)
540,Ahhhhhhh! He's back! ♡♡♡♡,1,4 hours ago,DEAN - DIE 4 YOU (Official Visualizer)
541,WELCOME BACK KING!!! ,1,1 day ago,DEAN - DIE 4 YOU (Official Visualizer)
542,"Thank you for coming back, Dean.",1,1 day ago,DEAN - DIE 4 YOU (Official Visualizer)
543,"노래 좋다! 겨울에 찰떡이랄까 이 멋진 곡 완성도에 반, 반의반이라도 좋으니 노래 많이많이 내줘여~~~",119,5 days ago,DEAN - DIE 4 YOU (Official Visualizer)
544,캬 드디어 나왔어 ㅠ 너무 좋네요.,0,4 days ago,DEAN - DIE 4 YOU (Official Visualizer)
545,깜짝 놀라서 들어옴!내가모르는 ai곡이? 하다가 계정채널로 들어가니 진짜 딘!!!!이 동영상 직전 음악영상이 4년전인게ㅠㅠ이제 종종 들려줘요! 이번곡 너무 좋아요!,1,4 days ago,DEAN - DIE 4 YOU (Official Visualizer)
546,I need an album please,1,4 days ago,DEAN - DIE 4 YOU (Official Visualizer)
547,"nobody. absolutely nobody could ever replace you, dean.",0,3 days ago,DEAN - DIE 4 YOU (Official Visualizer)
548,Thank you for coming back hyuk ️ Misses ur heavenly sweet voice,0,2 days ago,DEAN - DIE 4 YOU (Official Visualizer)
549,"Very unexpected comeback, glad to see your still into making music for your fans We love you Dean!!",12,5 days ago,DEAN - DIE 4 YOU (Official Visualizer)
550,좋다..,1,14 hours ago,DEAN - DIE 4 YOU (Official Visualizer)
551,omg I missed you!! absolutely ill  ,0,3 days ago,DEAN - DIE 4 YOU (Official Visualizer)
552,ai만 듣다가 찐 목소리 들으니까 너무 행복해 (　´つω；),1,2 days ago (edited),DEAN - DIE 4 YOU (Official Visualizer)
553,겨울에딱맞는노래인것같아...좋아...혁아 고마워..돌아와줘서,1,4 days ago,DEAN - DIE 4 YOU (Official Visualizer)
554,자막 번역달아준거 너무 좋다 섬세하네,1,3 days ago,DEAN - DIE 4 YOU (Official Visualizer)
555,"Thank you for coming back dean, we really missed you boy. Can’t wait for your future releases, love you <3",15,5 days ago,DEAN - DIE 4 YOU (Official Visualizer)
556,I missed him so much ,1,1 day ago,DEAN - DIE 4 YOU (Official Visualizer)
557,어쩌면 듣자마자 좋냐...,0,4 days ago,DEAN - DIE 4 YOU (Official Visualizer)
558,I literally cannot believe he is back-,1,3 hours ago,DEAN - DIE 4 YOU (Official Visualizer)
559,I can feel the heaven ,1,4 days ago,DEAN - DIE 4 YOU (Official Visualizer)
560,we missed you dean,1,3 days ago,DEAN - DIE 4 YOU (Official Visualizer)
561,심장을 데워주는 듯한 목소리딘멘돌아와줘서 고마워요,86,5 days ago (edited),DEAN - DIE 4 YOU (Official Visualizer)
562,I'm so glad Dean is back. Waaaawwwww....... ,0,1 day ago,DEAN - DIE 4 YOU (Official Visualizer)
563,I miss dean so much..For the past 2 month keep listening to all his song tho..,1,3 days ago,DEAN - DIE 4 YOU (Official Visualizer)
564,"mds tem tradução PT BR, ele quer nos matar de vez",0,3 days ago,DEAN - DIE 4 YOU (Official Visualizer)
565,"La espera valió totalmente la pena, Dean es un genio!Agradecida por tener la oportunidad de escuchar esta obra maestra, una de las voces más increíbles de la industria. Gracias Dean!",1,4 days ago,DEAN - DIE 4 YOU (Official Visualizer)
566,DEAN YOU ARE FINALLY BACK!!!!!!!,0,4 days ago,DEAN - DIE 4 YOU (Official Visualizer)
567,이것만으로도 진짜 감지덕지다... 정규앨범달라고하지마요 또 사라질라...🥹,118,5 days ago,DEAN - DIE 4 YOU (Official Visualizer)
568,"crying, this just reminds me of how much I missed him UGH",1,4 days ago,DEAN - DIE 4 YOU (Official Visualizer)
569,I WOULD DIE FOR YOU DEANN,0,1 day ago,DEAN - DIE 4 YOU (Official Visualizer)
570,good song!!!,0,4 days ago,DEAN - DIE 4 YOU (Official Visualizer)
571,I almost cried at work seeing that Dream made a song ,0,2 days ago,DEAN - DIE 4 YOU (Official Visualizer)
572,Dean sei e rimarrai sempre il migliore,0,4 days ago,DEAN - DIE 4 YOU (Official Visualizer)
573,"이 곡의  스타일이 그런것도 있겠지만 4년만에 듣는 목소리는 뭔가 조금 더 묵직하고 한음한음이 확실하게 들리네요 (그래도 이 비루한 귀는 새로운 곡만 듣는것만으로도 행복하다...) 그동안 나온 곡들만 무한루프하면서 딘 언제 다시오나 목빠지게 기다리고 있었는데... 다시 돌아와줘서 고마워요. 이제 어떤 스타일을 츄라이해도 괜찮으니 곡만 많이 내줘요, 묵혀놓기 너무 아까운 목소리야 진짜 ㅠㅠㅠㅠㅠ",58,5 days ago,DEAN - DIE 4 YOU (Official Visualizer)
574,딘 사랑해요...,0,3 days ago,DEAN - DIE 4 YOU (Official Visualizer)
575,"again, thankyou for this music dean",0,4 days ago,DEAN - DIE 4 YOU (Official Visualizer)
576,다시 한 번 제 심장이 뜀박질을 해요,1,4 days ago,DEAN - DIE 4 YOU (Official Visualizer)
577,So long time no see/ found him.. welcome back Dean,0,3 days ago,DEAN - DIE 4 YOU (Official Visualizer)
578,omg i missed DEAN !,1,3 days ago,DEAN - DIE 4 YOU (Official Visualizer)
579,Dean's music never disappoints,3,5 days ago,DEAN - DIE 4 YOU (Official Visualizer)
580,I don't wanna go'Til everything comes crashin' downYou're the one I wantWhen everything comes crashin' down,0,4 days ago,DEAN - DIE 4 YOU (Official Visualizer)
581,너무 좋다.ㅠㅠ 엉엉,1,1 day ago,DEAN - DIE 4 YOU (Official Visualizer)
582,CONRGATS 1M!!!! LETS GOOOOOO!!!!,1,8 hours ago,DEAN - DIE 4 YOU (Official Visualizer)
583,TE EXTRAÑE ,2,16 hours ago,DEAN - DIE 4 YOU (Official Visualizer)
584,THE RETURN OF THE KING!!!,0,3 days ago,DEAN - DIE 4 YOU (Official Visualizer)
585,"One of my most favourite artists is back and he's already making music that hurts me so bad, because it is hitting me right in the heart  Welcome back Dean",16,5 days ago,DEAN - DIE 4 YOU (Official Visualizer)
586,he doesn't know how much we miss him,2,3 days ago,DEAN - DIE 4 YOU (Official Visualizer)
587,"나의 지구가 이제야 움직이기 시작했다….. 그리고, 눈물이 벅차오르는 감동을 모두와 함께 할수 있어 이순간 자체가 너무 감사하다…",1,1 day ago,DEAN - DIE 4 YOU (Official Visualizer)
588,"welcome back , DEAN ",3,12 hours ago,DEAN - DIE 4 YOU (Official Visualizer)
589,WtfI really miss you babydamn my heart is beating so fast hearing his angelic voice again much love from Nigeria 🇳🇬🇳🇬🇳🇬️,0,2 days ago,DEAN - DIE 4 YOU (Official Visualizer)
590,Missed your music <3 Ty,1,1 day ago,DEAN - DIE 4 YOU (Official Visualizer)
591,"dios mío, llevaba tanto tiempo esperándolo, su esencia se ha mantenido intacta",13,5 days ago,DEAN - DIE 4 YOU (Official Visualizer)
592,"we'd all die 4 you, dean.welcome back my fav rebel ️",0,2 days ago,DEAN - DIE 4 YOU (Official Visualizer)
593,welcome back king. this is so good 🫶,1,3 days ago,DEAN - DIE 4 YOU (Official Visualizer)
594,딘 더 세인트해져서 돌아왔네,2,4 days ago,DEAN - DIE 4 YOU (Official Visualizer)
595,"ㅎㅎ 들을 때마다 이소라님의 청혼이 떠올라요  전혀 다른 음색이지만, 잊고있던 노래를 생각나게 하네요",0,2 days ago,DEAN - DIE 4 YOU (Official Visualizer)
596,NO FUCKING WAY... MY KING IS BACK FROM THE DEAD,1,4 days ago,DEAN - DIE 4 YOU (Official Visualizer)
597,This song sounds like heaven. I can't believe he's back. We're about to get some of the best music we've ever heard in the industry,13,5 days ago,DEAN - DIE 4 YOU (Official Visualizer)
598,Te extrañé dean,1,2 days ago,DEAN - DIE 4 YOU (Official Visualizer)
599,Welcome back to the smoovest voice in the game.,0,2 days ago,DEAN - DIE 4 YOU (Official Visualizer)
600,I LOVE HIM,0,4 days ago,DEAN - DIE 4 YOU (Official Visualizer)
601,J'adore,0,4 days ago,DEAN - DIE 4 YOU (Official Visualizer)
602,I really missed you dean,0,1 day ago,DEAN - DIE 4 YOU (Official Visualizer)
603,"Dean sin duda nunca decepciona con su música, me encanta y me alegra tanto que esté de regreso!!!",8,4 days ago,DEAN - DIE 4 YOU (Official Visualizer)
604,Dean welcome back! We've been waiting for you 🫶,0,4 days ago,DEAN - DIE 4 YOU (Official Visualizer)
605,와 진짜야? 진짜 돌아왔네 와 이제 다시 활발한 활동 기대할게요,0,4 days ago,DEAN - DIE 4 YOU (Official Visualizer)
606,Welcome back Dean,1,4 days ago,DEAN - DIE 4 YOU (Official Visualizer)
607,Welcome back Dean ,0,4 days ago,DEAN - DIE 4 YOU (Official Visualizer)
608,THE KING IS BACK ,0,2 days ago,DEAN - DIE 4 YOU (Official Visualizer)
609,At one point his voice hit me and I felt tears. He is one of only 3 artists that have this effect on me in all my 45 years on this earth. Thank you for gifting us with your beautiful music again,12,5 days ago,DEAN - DIE 4 YOU (Official Visualizer)
610,사운드에 미치신건가요 형님 얼마나 갈아 넣으신건가요.. 아마 수명을 갈아 넣으신 사운드 같은데 이정도면...,0,2 days ago,DEAN - DIE 4 YOU (Official Visualizer)
611,노래 내줘서 고맙습니다ㅠㅠ,0,4 days ago,DEAN - DIE 4 YOU (Official Visualizer)
612,Quem é vivo sempre aparece,0,4 days ago,DEAN - DIE 4 YOU (Official Visualizer)
613,개좋다,0,2 days ago,DEAN - DIE 4 YOU (Official Visualizer)
614,OUR KING  IS BACK,0,4 days ago,DEAN - DIE 4 YOU (Official Visualizer)
615,This deanfluenza is just what the world needed. He’s gonna heal the world with his voice.,19,5 days ago,DEAN - DIE 4 YOU (Official Visualizer)
616,The KING is back ,0,3 days ago,DEAN - DIE 4 YOU (Official Visualizer)
617,개떡같이 내도 찰떡같이 들을테니까... ㅜㅜ 제... 제발~~ 계속 좀 내주라 딘형~ ㅜㅜ,3,4 days ago,DEAN - DIE 4 YOU (Official Visualizer)
618,HES BACK ️️️ IVE BEEN WAITING,1,3 days ago (edited),DEAN - DIE 4 YOU (Official Visualizer)
619,Thank you for coming back around the same time I discovered you,0,4 days ago,DEAN - DIE 4 YOU (Official Visualizer)
620,Dean we missed u so much to say the least🫶,0,1 day ago,DEAN - DIE 4 YOU (Official Visualizer)
621,He came back to life like a phoenix and is reborn again for us to listen to his music one more time ,9,5 days ago,DEAN - DIE 4 YOU (Official Visualizer)
622,no one can explain how i feel ,0,1 day ago,DEAN - DIE 4 YOU (Official Visualizer)
623,You've been missed dude! Welcome back,0,4 days ago,DEAN - DIE 4 YOU (Official Visualizer)
624,HE'S BACCCKKKK?!?!?! MY JAW DROPPPED WHEN I SAW THIS UPDATE️,2,3 days ago,DEAN - DIE 4 YOU (Official Visualizer)
625,te adoro tanto ️,1,17 hours ago,DEAN - DIE 4 YOU (Official Visualizer)
626,He's back!!!! ,1,4 days ago,DEAN - DIE 4 YOU (Official Visualizer)
627,돌아와줘서 고맙다 진짜 목빠지게 기다렸는데 역시 실망시키지 않네 노래 좋아서 너무 좋아.......,23,5 days ago,DEAN - DIE 4 YOU (Official Visualizer)
628,"혁아..AI로는 절대 너의 에드립을 느낄 수 없었어이미 질 수 없는 게임이란 걸 알지만,다음 작품을 듣고 싶기에..",0,4 days ago,DEAN - DIE 4 YOU (Official Visualizer)
629,Welcome back DEANNNNNN!,0,4 days ago,DEAN - DIE 4 YOU (Official Visualizer)
630,,1,18 hours ago,DEAN - DIE 4 YOU (Official Visualizer)
631,흐어어어어어엉 ㅠㅠ 음원 내줘서 고마워요 ㅠㅠ,0,2 days ago,DEAN - DIE 4 YOU (Official Visualizer)
632,DEAN NEVER RELEASES SKIPS,1,3 days ago,DEAN - DIE 4 YOU (Official Visualizer)
633,"Thank you so so much Dean, for making music. I'm crying already and the song just started",6,5 days ago,DEAN - DIE 4 YOU (Official Visualizer)
634,"After ages!!!! Thank you, sir!",1,2 days ago,DEAN - DIE 4 YOU (Official Visualizer)
635,AMAZING,1,2 days ago,DEAN - DIE 4 YOU (Official Visualizer)
636,quem é vivo sempre aparece,0,2 days ago,DEAN - DIE 4 YOU (Official Visualizer)
637,Welcome back DEAN ,0,4 days ago,DEAN - DIE 4 YOU (Official Visualizer)
638,"todos calem a boca, o rei está cantando!!1!!!!11!!",0,2 days ago,DEAN - DIE 4 YOU (Official Visualizer)
639,dean truly is a gift from the highest heavens words cant even begin to explain the joy in my heart from hearing his voice again. how can one man be so beautifully talented it blows my mind,28,5 days ago,DEAN - DIE 4 YOU (Official Visualizer)
640,Nothing else to say but ‘Welcome back!!’ ,1,23 hours ago (edited),DEAN - DIE 4 YOU (Official Visualizer)
641,오빠 기다리는동안 사실 좀 지치고 힘들었는데 그만큼 아니 그보다 더한 선물을 받는 것 같아. 주구장창 듣고 있으니까 오빠 하고 싶은 음악 다 하자사랑해~,0,3 days ago,DEAN - DIE 4 YOU (Official Visualizer)
642,I love you so much dean,0,1 day ago,DEAN - DIE 4 YOU (Official Visualizer)
643,I'm falling in love again :'),2,17 hours ago,DEAN - DIE 4 YOU (Official Visualizer)
644,Dean you da best,1,6 hours ago,DEAN - DIE 4 YOU (Official Visualizer)
645,I’m receiving this song as an early Christmas gift from Dean after many years of waiting  If an album comes with it later then we should at least be good for another couple years 🥹,13,5 days ago (edited),DEAN - DIE 4 YOU (Official Visualizer)
646,"Oh man, miss your voice & your music that i had to go rely on AI for cover songs voiced by you.",0,4 days ago,DEAN - DIE 4 YOU (Official Visualizer)
647,이 정신나갈것 같은 보컬.. 너무 그리웠다 권혁.. 이제 자주좀 나와줘..,0,4 days ago,DEAN - DIE 4 YOU (Official Visualizer)
648,OMG DADDY DEANNN IM CRYING BAE IVE BEEN WAITING FOR UR ASSSS AND U DELIVERED AHHHH I COULD CRRYYYY.THIS SHIT MAKES ME LEVITATEEEE,2,3 days ago,DEAN - DIE 4 YOU (Official Visualizer)
649,목소리도 더 좋아진 것 같고 노래도 뜰 것 같음,1,2 days ago,DEAN - DIE 4 YOU (Official Visualizer)
650,아니..진짜 different R&B다….,1,20 hours ago,DEAN - DIE 4 YOU (Official Visualizer)
651,after 3 years of listening to deans music this is the best song I've heard so far it was worth the wait️,11,5 days ago,DEAN - DIE 4 YOU (Official Visualizer)
652,드뎌 컴백 ,0,2 days ago,DEAN - DIE 4 YOU (Official Visualizer)
653,"DIOS MIO, ME LOQUEE HORRIBLE CUANDO VI LA NOTIFICACIÓN",0,3 days ago,DEAN - DIE 4 YOU (Official Visualizer)
654,THE LEGEND IS BACK AUGHHHHH,1,3 days ago,DEAN - DIE 4 YOU (Official Visualizer)
655,"Finalmente, meu patrão",1,2 days ago,DEAN - DIE 4 YOU (Official Visualizer)
656,Feels like my dad came back with the milk,1,1 hour ago,DEAN - DIE 4 YOU (Official Visualizer)
657,Eu realmente amo os vocais do Dean! Grata surpresa.,7,4 days ago,DEAN - DIE 4 YOU (Official Visualizer)
658,डिन दाजु धन्यवाद यो गितकोलागि र congratulation ,1,2 days ago,DEAN - DIE 4 YOU (Official Visualizer)
659,천재 딘,2,3 days ago,DEAN - DIE 4 YOU (Official Visualizer)
660,King is back ,1,20 hours ago,DEAN - DIE 4 YOU (Official Visualizer)
661,"Been waiting for so damn long for ur comeback bae, pls don't leave again.. I'll give this song to u my lovePls watch ur steps while u going on the stairs lol don't wanna miss u ever again",1,3 days ago,DEAN - DIE 4 YOU (Official Visualizer)
662,I am glad that he is back,1,4 days ago,DEAN - DIE 4 YOU (Official Visualizer)
663,첫 소절 듣자마자 띵곡이란 게 느껴지네ㅜㅜ,23,5 days ago,DEAN - DIE 4 YOU (Official Visualizer)
664,Finally some Dean!Thx,1,1 day ago,DEAN - DIE 4 YOU (Official Visualizer)
665,딘 살아있었구나 ... !,0,4 days ago,DEAN - DIE 4 YOU (Official Visualizer)
666,THE KING IS BACK,1,4 days ago,DEAN - DIE 4 YOU (Official Visualizer)
667,이게 진정… 놀라워 ㅠㅠ 수능 끝났더니 단 컴백 실화임,1,3 days ago,DEAN - DIE 4 YOU (Official Visualizer)
668,He was absent all this time making this treasure,0,4 days ago,DEAN - DIE 4 YOU (Official Visualizer)
669,진짜진짜 정말이지 너무 행복하다 누군가의 작업물로 이렇게까지 행복해질 수 있다니부디 계속 음악해줘요.... 진짜 존나 사랑한다 권혁,28,5 days ago (edited),DEAN - DIE 4 YOU (Official Visualizer)
670,omg im actually crying right now you're back ,0,4 days ago,DEAN - DIE 4 YOU (Official Visualizer)
671,Good to see u back again my man,1,1 day ago,DEAN - DIE 4 YOU (Official Visualizer)
672,mano eu te amo,1,1 day ago,DEAN - DIE 4 YOU (Official Visualizer)
673,"Welcome back, Dean!",1,10 hours ago,DEAN - DIE 4 YOU (Official Visualizer)
674,기대 했던 거 보다 좋네.,1,1 day ago,DEAN - DIE 4 YOU (Official Visualizer)
675,"La espera  Valió la pena cada minutos de esta canción, se merece todos las ovaciones del mundo, gracias por volver DEAN volvió contigo mi estabilidad emocional.",4,5 days ago (edited),DEAN - DIE 4 YOU (Official Visualizer)
676,이것은 아름답습니다.,0,1 day ago,DEAN - DIE 4 YOU (Official Visualizer)
677,WE MISSEDDDD YOUUUUU ,1,2 days ago,DEAN - DIE 4 YOU (Official Visualizer)
678,"Speed this up to 1,25x ---------- you won't regret it.",2,1 day ago,DEAN - DIE 4 YOU (Official Visualizer)
679,I’m crying happy tears️,0,4 days ago,DEAN - DIE 4 YOU (Official Visualizer)
680,HONEY VOCALS,1,1 day ago,DEAN - DIE 4 YOU (Official Visualizer)
681,after hearing ai covers with your voice finally you’ve come back with a new song Dean we missed you so much ️‍,11,5 days ago,DEAN - DIE 4 YOU (Official Visualizer)
682,I missed you my dear Dean. Welcome back to home,1,2 days ago,DEAN - DIE 4 YOU (Official Visualizer)
683,Mans just amazing af,0,4 days ago,DEAN - DIE 4 YOU (Official Visualizer)
684,노래가존나좋다고이래도되냐고진짜정신병ㄱㄹ릴거같다고ㅜ,2,9 hours ago,DEAN - DIE 4 YOU (Official Visualizer)
685,I fallin love with you...Dean... ,0,1 day ago,DEAN - DIE 4 YOU (Official Visualizer)
686,I heard rumours that the prince is back. THE PRINCE IS BACK,1,4 days ago,DEAN - DIE 4 YOU (Official Visualizer)
687,"Esperei tanto por esse momento, Dean é um sentimento de tão bom",4,5 days ago,DEAN - DIE 4 YOU (Official Visualizer)
688,제발..... 너무기다렸어요 드디어ㅠㅠㅠㅠㅠㅠㅠㅠㅠㅠㅠ,0,1 day ago,DEAN - DIE 4 YOU (Official Visualizer)
689,Welcome back bro..I hope you are fine and healthy,0,1 day ago,DEAN - DIE 4 YOU (Official Visualizer)
690,I love this songg smm,1,2 days ago,DEAN - DIE 4 YOU (Official Visualizer)
691,실수로 1.5배로 들었는데 왜렇게 좋냐ㅋㅋㅋ,1,19 hours ago,DEAN - DIE 4 YOU (Official Visualizer)
692,"come here and hold me, make me feel better. promise me i'm good enough, tell me you can love me, even the worst of me. even the worst.",0,1 day ago,DEAN - DIE 4 YOU (Official Visualizer)
693,"Dios, no tienes idea de cuanto tiempo he esperado por tu regreso, mis oidos estan siendo vendecidos por tu hermosa voz, te quiero mucho Dean TT_TT",4,5 days ago,DEAN - DIE 4 YOU (Official Visualizer)
694,I MISSED HIM SO MUCH,0,3 days ago,DEAN - DIE 4 YOU (Official Visualizer)
695,DEAN I WANT TO APOLOGIZE FOR EVER JOKING ABT YOU FALLING DOWN THE STAIRS I LOVE YOU SM ,1,4 days ago,DEAN - DIE 4 YOU (Official Visualizer)
696,THE KING IS BACK,0,4 days ago,DEAN - DIE 4 YOU (Official Visualizer)
697,"miss your voice so much bro,you slay again ",0,1 day ago,DEAN - DIE 4 YOU (Official Visualizer)
698,Love dean,0,3 days ago,DEAN - DIE 4 YOU (Official Visualizer)
699,"Thank you Dean for coming back, can't  believe its been 4 years. Hope you are doing well and your voice is soothing as always. Congrats on the new song!!",15,5 days ago,DEAN - DIE 4 YOU (Official Visualizer)
700,"Te amo, te extrañé 🩵",0,2 days ago,DEAN - DIE 4 YOU (Official Visualizer)
701,하 angeltic,1,14 hours ago,DEAN - DIE 4 YOU (Official Visualizer)
702,the king of krnb is back ,0,3 days ago,DEAN - DIE 4 YOU (Official Visualizer)
703,LONG TIME NO SEE CONGRATULATION ,1,1 day ago,DEAN - DIE 4 YOU (Official Visualizer)
704,FINALLY MY GUYS BACK,1,3 days ago,DEAN - DIE 4 YOU (Official Visualizer)
705,이 날씨에 듣기에 너무 딱이에요.. 딘 제발 음악 많이 해주세요,27,5 days ago,DEAN - DIE 4 YOU (Official Visualizer)
706,기다렸어요. 오래도록....I've been waiting for you for a long long time.,1,2 days ago,DEAN - DIE 4 YOU (Official Visualizer)
707,godddddddd i can’t believe my eyesssssss ,1,4 days ago,DEAN - DIE 4 YOU (Official Visualizer)
708,Finally my man is back,1,7 hours ago,DEAN - DIE 4 YOU (Official Visualizer)
709,인기 급상승 에 딘 이란 이름을 보고 화들짝 놀라 들어왔다,2,4 days ago,DEAN - DIE 4 YOU (Official Visualizer)
710,,2,3 days ago,DEAN - DIE 4 YOU (Official Visualizer)
711,November is really full of good things. dean just suddenly came back and released a song... it's so beautiful.,35,5 days ago,DEAN - DIE 4 YOU (Official Visualizer)
712,헬스장에서 운동하다가 나온 음악이 아무리들어도 딘인데 이거 뭐지 Ai인가 한참 생각하다가 혹시나 하고 검색했는데... 감사합니다 감사합니다,0,1 day ago,DEAN - DIE 4 YOU (Official Visualizer)
713,"WELCOME BACK, KING!",0,3 days ago,DEAN - DIE 4 YOU (Official Visualizer)
714,HE'S BACK!!!!,1,3 days ago,DEAN - DIE 4 YOU (Official Visualizer)
715,돌아와줘서 고맙구요 건강하기만 하셔요...,2,2 days ago,DEAN - DIE 4 YOU (Official Visualizer)
716,WELCOME BACK DEAN,1,2 days ago,DEAN - DIE 4 YOU (Official Visualizer)
717,Dean's artistry will never let me down wow,12,5 days ago,DEAN - DIE 4 YOU (Official Visualizer)
718,와… 드디어 ai딘 말고 찐.. ㅠㅠ 돌아와줘서 너뮤 고마워요 ㅠㅠㅠ,1,4 days ago,DEAN - DIE 4 YOU (Official Visualizer)
719,"After the long wait, DEAN is finally here and love this new song!! Come check out my cover of DIE 4 YOU and other DEAN songs :)",1,4 days ago,DEAN - DIE 4 YOU (Official Visualizer)
720,DEAN finally u came back!!!!!!!,1,2 days ago,DEAN - DIE 4 YOU (Official Visualizer)
721,우리 권혁씨가 하는 I know가 세상에서 제일 좋아합니다…🩷다시 와줘서 고맙고 사랑한다,1,3 days ago,DEAN - DIE 4 YOU (Official Visualizer)
722,HE BACK FROM THE DEAD Y'ALL,1,2 days ago,DEAN - DIE 4 YOU (Official Visualizer)
723,Dood literally brought back the same feelings of Instagram. The hit just came out of nowhere and all the respect to his craft. Hope he's back for a while and feeling better after that long needed break.,9,5 days ago,DEAN - DIE 4 YOU (Official Visualizer)
724,THANK YOU FOR COMING BACK TO SAVE KRNB,1,3 days ago,DEAN - DIE 4 YOU (Official Visualizer)
725,yine mükemmelsin,0,2 days ago,DEAN - DIE 4 YOU (Official Visualizer)
726,I don't know who Dean is but this just popped up as a recommendation and I really like it,0,17 minutes ago,DEAN - DIE 4 YOU (Official Visualizer)
727,dean finally comeback!!!!!!!!!!!!!!!!!!!!!!,0,3 days ago,DEAN - DIE 4 YOU (Official Visualizer)
728,the king is back ,1,3 days ago,DEAN - DIE 4 YOU (Official Visualizer)
729,음색 미쳤다 진짜ㅠㅠㅠㅠㅠ,13,5 days ago,DEAN - DIE 4 YOU (Official Visualizer)
730,고마워 음원 내 줘서 사랑해,1,12 hours ago,DEAN - DIE 4 YOU (Official Visualizer)
731,Thank God dean exists,2,2 days ago,DEAN - DIE 4 YOU (Official Visualizer)
732,Al fin volviste,1,1 day ago,DEAN - DIE 4 YOU (Official Visualizer)
733,유튜브로도 한번 귀 조져주고 스트리밍도 돌리고 후리고 쌈싸먹고~ 행복사,0,4 days ago,DEAN - DIE 4 YOU (Official Visualizer)
734,todavia no puedo creer que volviste,0,4 days ago,DEAN - DIE 4 YOU (Official Visualizer)
735,그냥 왜인지 돌아올 것 같았다 딘 돌아와줘서 고마워 하루도 잊은 적 없어,17,5 days ago,DEAN - DIE 4 YOU (Official Visualizer)
736,"can't believe it, our long waiting is become real",0,4 days ago,DEAN - DIE 4 YOU (Official Visualizer)
737,딘씨 오랜만입니다.우리는 모르는 사이예요.그런데 너무 반가워요.음악 좋아요. 그런데 반가운 것이 더 크네요!!,1,4 days ago,DEAN - DIE 4 YOU (Official Visualizer)
738,te amo dean,0,4 days ago,DEAN - DIE 4 YOU (Official Visualizer)
739,AI가 아닌 딘이라니ㅠㅠㅠ감동입니다ㅠㅠ,1,3 days ago,DEAN - DIE 4 YOU (Official Visualizer)
740,내 시계가 다시 돌아가기 시작했다..,1,4 days ago,DEAN - DIE 4 YOU (Official Visualizer)
741,마음을 후벼파는 음색,19,5 days ago,DEAN - DIE 4 YOU (Official Visualizer)
742,찬바람 맞으며 담배피면서 들어봐라.아주 괜찮은 곡이다.,3,23 hours ago,DEAN - DIE 4 YOU (Official Visualizer)
743,คุณกลับมาแล้วจริงๆㅠ รอฟังเพลงคุณนานมาก ㅠㅠ,0,1 day ago,DEAN - DIE 4 YOU (Official Visualizer)
744,Ima say it MY man is back,1,4 days ago,DEAN - DIE 4 YOU (Official Visualizer)
745,Te extraño demasiado ,0,3 days ago,DEAN - DIE 4 YOU (Official Visualizer)
