,comment,like,time,title_list
296,패스100%^가 좋은 수치많은 아닌거같음 백패스가 많아서 그런거같은데 강인이는 공격적으로 찔러주는게 강인이 다운거같음,0,3 days ago,음바페가 이강인을 유독 좋아하는 이유
297,1:55 요 상황이 어떤 경기였는지 알 수 있나요??? 실제 어땠는지 보고싶어요 후하,2,3 days ago,음바페가 이강인을 유독 좋아하는 이유
298,형 제이미바디 심층분석 해주세요!!,0,3 days ago,음바페가 이강인을 유독 좋아하는 이유
299,우리의 영웅 닌자거북이,5,3 days ago,음바페가 이강인을 유독 좋아하는 이유
300,투레 분석 좀 부탁드려요,0,18 hours ago,음바페가 이강인을 유독 좋아하는 이유
301,깡페 커플 최고다,2,3 days ago,음바페가 이강인을 유독 좋아하는 이유
302,강인아 진짜 다치지말고 이대로만 커다오,0,2 days ago,음바페가 이강인을 유독 좋아하는 이유
303,어릴 때부터 별명이 노력하는 축구천재인 건 다 이유가 있구만?,0,3 days ago,음바페가 이강인을 유독 좋아하는 이유
304,같은 그림을 보는 플레이어를 만나면 기분이 좋아진다.,0,3 days ago,음바페가 이강인을 유독 좋아하는 이유
305,축구잘하면 다 좋아하지  영ㄱ상도 좋네요 구독합니다 ㅋㅋㅋ,0,3 days ago (edited),음바페가 이강인을 유독 좋아하는 이유
306,이상한 제목 어그로 끄는 축알못들이랑 달라서 넘좋다,1,2 days ago (edited),음바페가 이강인을 유독 좋아하는 이유
307,오늘도 재밌는 진짜킴,2,3 days ago (edited),음바페가 이강인을 유독 좋아하는 이유
308,음단장 레알에 강인이 데려가,3,3 days ago,음바페가 이강인을 유독 좋아하는 이유
309,깡페조합 좋다. 굿. 음~짱!!,0,3 days ago,음바페가 이강인을 유독 좋아하는 이유
310,이강인은 아는거지 제2의 베르나루드실바가 강인이라는거,1,3 days ago,음바페가 이강인을 유독 좋아하는 이유
311,내가 김진짜를 구독하는 이유,0,2 days ago,음바페가 이강인을 유독 좋아하는 이유
312,너무 재밌음,0,3 days ago,음바페가 이강인을 유독 좋아하는 이유
313,진짜 지금봐도 안믿기네 음바페 네이마르랑 저런 투샷찍는거랑 김민재도 뮐러랑 투샷보면 합성같다,0,3 days ago,음바페가 이강인을 유독 좋아하는 이유
314,근들갑이 아니라 이강인은 뭔가 좀 다르긴 함. 더 좋은 클럽으로 갈 수 있을 듯,0,3 days ago,음바페가 이강인을 유독 좋아하는 이유
315,멋진 이강인 선수님  내일- 2023년 11월 21일 화요일 중국 전에서 1골 2어시 쌓읍시다  건강하고 행복하게 축구 하세요  대한민국 국가대표팀 6대 0으로 승리 합시다  화이팅 ,0,3 days ago,음바페가 이강인을 유독 좋아하는 이유
316,그날이 제생일입니다 ㅋㅋ 좋은성과좀 봤으면 좋겠네요,1,3 days ago,음바페가 이강인을 유독 좋아하는 이유
317, @catsabba  생일 축하해요 멋진 이강인 선수님  공포로 특별히 행복한 날 되세요~,0,3 days ago,음바페가 이강인을 유독 좋아하는 이유
318,️️,2,3 days ago,음바페가 이강인을 유독 좋아하는 이유
319,음바페 - 이강인홀란드 - 황희찬,1,3 days ago,음바페가 이강인을 유독 좋아하는 이유
320,결론: 뎀벨레는 뭘 해도 골은 못 넣는다,0,12 hours ago,음바페가 이강인을 유독 좋아하는 이유
321,둘이 손잡고 레알 가자!!,0,3 days ago,음바페가 이강인을 유독 좋아하는 이유
322,중간에 한번씩 뎀벨레 까는거 개웃기네ㅋㅋㅋㅋㅋㅋㅋㅋㅋㅋㅋㅋ,4,3 days ago,음바페가 이강인을 유독 좋아하는 이유
323,강페라인 올해가 마지막인가 정녕...,0,2 days ago,음바페가 이강인을 유독 좋아하는 이유
324,월래 K드라마 특징이 케인 손흥민 러브라인 끝나니까 다른 러브 라인이 시작되는 그런 구조임,1,3 days ago,음바페가 이강인을 유독 좋아하는 이유
325,김진짜가 말하면 진짜다 이것이 내 결론이다,0,3 days ago,음바페가 이강인을 유독 좋아하는 이유
326,영상을 오래볼수있게 만드는 편집을 고민하신것같군요 쇼츠보듯 재밌게봤네요,0,3 days ago,음바페가 이강인을 유독 좋아하는 이유
327,오 이강인+음바페 줄이니 깡패조합이구나 !,0,16 hours ago,음바페가 이강인을 유독 좋아하는 이유
328,음바페 빨리 레알로 제발가라,4,3 days ago,음바페가 이강인을 유독 좋아하는 이유
329,뎀벨레 은근 까는게 킬포넼ㅋㅋㅋㅋㅋ,0,3 days ago,음바페가 이강인을 유독 좋아하는 이유
330,김진짜가 다른 유튜버들과 다른 이유,0,3 days ago,음바페가 이강인을 유독 좋아하는 이유
331,호날두가 메수트 외질을 좋아하는 이유와 동일하네용,0,2 days ago,음바페가 이강인을 유독 좋아하는 이유
332,호날두가 외질을 유독 좋아한거랑 결이 비슷하네요,0,2 days ago,음바페가 이강인을 유독 좋아하는 이유
333,"음바페 팀 장악하고 월권 행사하는거 진짜 마음에 안드는데, 이번시즌동안 강인이랑 많이 친해져서 레알 가가지고 월권 행사해서 이강인 대려와달라고 하면 좋겠당.",0,1 day ago,음바페가 이강인을 유독 좋아하는 이유
334,압박에의한 볼 커트후 패스 ~ 뎀벨레 노골 ㅋㅋㅋㅋㅋㅋㅋㅋㅋㅋㅋㅋㅋㅋㅋㅋㅋ,0,12 hours ago,음바페가 이강인을 유독 좋아하는 이유
335,진짜 유툽은진짜다!!,0,3 days ago,음바페가 이강인을 유독 좋아하는 이유
336,지금 음바페와 이강인을 보면레알마드리드 1617시즌 호날두와이스코조합 같음,0,3 days ago,음바페가 이강인을 유독 좋아하는 이유
337,김진짜형 마루셀루를 잘몰르는데 분석해주세요!,0,3 days ago,음바페가 이강인을 유독 좋아하는 이유
338,아시아의 메수트외질 이강인~,0,3 days ago,음바페가 이강인을 유독 좋아하는 이유
339,걱정은 기우였다그냥 날아다니네 ㄷㄷ,0,3 days ago,음바페가 이강인을 유독 좋아하는 이유
340,진짜님 혹시 영상에 쓰이는 사진자료는 어디서 가져오시나요?,0,2 days ago,음바페가 이강인을 유독 좋아하는 이유
341,진짜 이강인보다 김진짜가 진짜 좋아요,0,3 days ago,음바페가 이강인을 유독 좋아하는 이유
342,깡페 조합 어감 좋은데,0,2 days ago,음바페가 이강인을 유독 좋아하는 이유
343,강인이 데리고 레알가줘..바페야,0,2 days ago,음바페가 이강인을 유독 좋아하는 이유
344,표정이 시종일관 킹받네 ..ㅋㅋㅋㅋㅋㅋㅋ,0,2 days ago,음바페가 이강인을 유독 좋아하는 이유
345,숨쉬듯 뎀벨레 까는거 개웃기네ㅋㅋㅋㅋㅋ,0,1 day ago,음바페가 이강인을 유독 좋아하는 이유
346,진짜형 셋째는 이강인한테 부탁하면 될듯 !,0,2 days ago,음바페가 이강인을 유독 좋아하는 이유
347,강인이 슈팅이 달라졌던데 누가 가르쳐준거 같은데음바페일까 손흥민일까혼자서 단기간에 슈팅이 좋아질리는 없고..,0,2 days ago,음바페가 이강인을 유독 좋아하는 이유
348,김진짜가진짜다,0,2 days ago,음바페가 이강인을 유독 좋아하는 이유
349,김보경선수가 강인랑 같이 처음 볼차는 날 이니에스타나 사비 같은 향이 나는걸 느꼈다 했다 흥민이 승호 한테는 느끼지 못했던걸 느꼈다고.... 약4년전 ㅎ 얜 모지? 왜잘하지? 라며 ㅋㅋㅋㅋㅋ,1,3 days ago,음바페가 이강인을 유독 좋아하는 이유
350,이강인 라인 잘 탔네 ㅋㅋ,2,3 days ago,음바페가 이강인을 유독 좋아하는 이유
351,음바페가 뎀밸레 요청해서 데리고 온것처럼 바페가 레알가면 강인이 같이 데려와 달라할거 같음. ㅋㅋ 강인이 레알까지도 갈수 있을거 같음,0,3 days ago,음바페가 이강인을 유독 좋아하는 이유
352,뎀벨레는 음바페가 부르지 않았어요뤼카보고 파리 오라고 했어요뎀벨레는 감독픽 뤼카가 음바페픽이에요,0,3 days ago,음바페가 이강인을 유독 좋아하는 이유
353,레알도 바페한테 먹히는건가,0,1 day ago,음바페가 이강인을 유독 좋아하는 이유
354,김진짜는 재연할때 좃나웃김,1,3 days ago,음바페가 이강인을 유독 좋아하는 이유
355,ㅋㅋㅋㅋㅋㅋ뎀벨레 물론 못넣어욬ㅋㅋㅋ,3,3 days ago,음바페가 이강인을 유독 좋아하는 이유
356,이강인 음바페 손잡고 레알로 가자,0,3 days ago,음바페가 이강인을 유독 좋아하는 이유
357,그렇게 음바페는 레알로 떠났다.,0,1 day ago,음바페가 이강인을 유독 좋아하는 이유
358,ㅋㅋㅋㅋㅋㅋ 뎀벨레가 파리에서 뛰면 안돼는 이유도 아니고 개웃기네 그냥,0,3 days ago,음바페가 이강인을 유독 좋아하는 이유
359,크~~!!  너무좋아,0,10 hours ago,음바페가 이강인을 유독 좋아하는 이유
360,형 밀란의 레전드 말디니 분석해줘,0,1 day ago,음바페가 이강인을 유독 좋아하는 이유
361,영상이 너무 재밌고 알차다...,0,2 days ago,음바페가 이강인을 유독 좋아하는 이유
362,3:35 저게 다이어 포함 예전 토트넘 수비수들 미드필더한데 저렇게 주니 받을때 애매하지…,1,3 days ago,음바페가 이강인을 유독 좋아하는 이유
363,이게 사실이면 음바페 레알가면 같이...,0,3 days ago,음바페가 이강인을 유독 좋아하는 이유
364,김진짜는 진짜~~~ 최고다♡^^♡,1,3 days ago,음바페가 이강인을 유독 좋아하는 이유
365,깡페조합 가즈아 !!,0,3 days ago,음바페가 이강인을 유독 좋아하는 이유
366,최고는 최고가 알아보는 법,0,10 hours ago,음바페가 이강인을 유독 좋아하는 이유
367,눈 많이 오는데도 촬영 고생하셨어요,2,3 days ago,음바페가 이강인을 유독 좋아하는 이유
368,내가진짜김진짜를유독좋와하는이유ㅋㅋㅋ,0,3 days ago,음바페가 이강인을 유독 좋아하는 이유
369,이강인 선수가 탭댄스를 좋아 할줄이야 진짜에서 알았네 ㅋㅋㅋㅋ ㅋㅋㅋㅋ ㅋㅋㅋㅋ ㅋㅋㅋㅋ ㅋㅋㅋㅋ ㅋㅋㅋㅋ ㅋㅋㅋㅋ ㅋㅋㅋㅋ ㅋㅋㅋㅋ   ,0,3 days ago,음바페가 이강인을 유독 좋아하는 이유
370,do as infinity 강인리!!!,0,13 hours ago,음바페가 이강인을 유독 좋아하는 이유
371,깔끔하네요,0,3 days ago,음바페가 이강인을 유독 좋아하는 이유
372,프레임 고견 감사요 ㅎㅎ,0,3 days ago,음바페가 이강인을 유독 좋아하는 이유
373,축구장에서 연기?하시는 거 넘 잼나요ㅎㅎ,0,3 days ago,음바페가 이강인을 유독 좋아하는 이유
374,음바페 레알가고 보드진한테 이강인 영입 시켜달라하겠다,0,3 days ago,음바페가 이강인을 유독 좋아하는 이유
375,강인이 성공했네,2,3 days ago,음바페가 이강인을 유독 좋아하는 이유
376,친화력만큼은 0티어 씹월클 ㅇㅈ,0,3 days ago,음바페가 이강인을 유독 좋아하는 이유
377,김진짜 청년.,1,3 days ago,음바페가 이강인을 유독 좋아하는 이유
378,레알갈때 강인과 같이가자,0,3 days ago,음바페가 이강인을 유독 좋아하는 이유
379,깨알 뎀벨레 디스하기 개웃기네 ㅋㅋㅋㅋ,0,2 days ago,음바페가 이강인을 유독 좋아하는 이유
380,강인이 메시처럼 된다,0,2 days ago,음바페가 이강인을 유독 좋아하는 이유
381,음바페랑 손잡고 레알 가자,0,3 days ago,음바페가 이강인을 유독 좋아하는 이유
382,김진짜 님잘생겼어요.   진심,1,3 days ago,음바페가 이강인을 유독 좋아하는 이유
383,ㅋㅋㅋ 진짜의 국뽕티비,1,3 days ago,음바페가 이강인을 유독 좋아하는 이유
384,"음바페 파리에 언제까지 있을까, 음바페 떠나면 진짜 혼돈일거같은데",0,2 days ago,음바페가 이강인을 유독 좋아하는 이유
385,유독 좋아하는 이유 다들 조심하지만 알잖아 …?!,0,3 days ago,음바페가 이강인을 유독 좋아하는 이유
386,강인아 40살까지 뛸려면 부상조심하자~,0,1 hour ago,음바페가 이강인을 유독 좋아하는 이유
387,ㅋㅋㅋㅋ 뎀벨레......,3,3 days ago,음바페가 이강인을 유독 좋아하는 이유
388,깡패조합 ㅋㅋㅋㅋㅋ,1,3 days ago,음바페가 이강인을 유독 좋아하는 이유
389,손케 듀오를 이끌 이음듀오가 된다면..,0,3 days ago,음바페가 이강인을 유독 좋아하는 이유
390,뎀벨레 계속 못하냐곸ㅋㅋㅋㅋㅋㅋㅋㅋㅋㅋㅋㅋ,1,3 days ago,음바페가 이강인을 유독 좋아하는 이유
391,"내 생각은 좀 다른데...ㅋㅋ기본적으로 공을 잘 차니깐 좋아할 수도 있는데, 일단 프랑스 내에서 한국 문화 파워가 엄청나게 올라가 있는 상태이고, 또 한국의 슈퍼루키가 강인이이기 때문에 인맥적으로도 친해지면 좋지...",0,3 days ago,음바페가 이강인을 유독 좋아하는 이유
392,ㅋㅋ 헛소리하네,5,3 days ago,음바페가 이강인을 유독 좋아하는 이유
393,그딴것때메 좋아하겠냐 걍 본인이랑 잘맞으니까 좋아하것지,1,2 days ago,음바페가 이강인을 유독 좋아하는 이유
394,음바페 반년뒤에 떠날건데 아쉽겠네 ㅋㅋㅋㅋ,1,2 days ago,음바페가 이강인을 유독 좋아하는 이유
395,눈 오지게 내리네요 ㅋㅋㅋ 고생하신 덕분에 영상 재밌게 봤습니다,2,3 days ago,음바페가 이강인을 유독 좋아하는 이유
396,깡페 공포 가자,1,3 days ago,음바페가 이강인을 유독 좋아하는 이유
397,애국 청년,1,3 days ago,음바페가 이강인을 유독 좋아하는 이유
398,"캐미요? 그딴건 관심없고,안 좋게 말하면 딱까리 역할을 아주 잘해주니깐. 중요한건 음바페 뒤에서 뛰는 한  발전은 없습니다. 이강인은 프리롤로 뛰면서 어디서든 공격참여를 해야만 하는 스타일입니다.지금 파리는 이강인의 재능을 10프로 밖에 안쓰는 겁니다. ",0,3 days ago,음바페가 이강인을 유독 좋아하는 이유
399,잘한다~~~~굿굿!!,0,3 days ago,음바페가 이강인을 유독 좋아하는 이유
400,음바페가 이강인 선수 좋아하는 이유 : 몇 안되는 동생이라서,0,3 days ago,음바페가 이강인을 유독 좋아하는 이유
401,네이마르 라인인줄 알았는데 ㅋㅋㅋ,0,2 days ago,음바페가 이강인을 유독 좋아하는 이유
402,형 3일전 영상인데 왜 눈이 내려 ...?  미래에서 온거야?,1,9 hours ago,음바페가 이강인을 유독 좋아하는 이유
403,03:53 웃음만 뎀벨레 특 ㅋㅋ,0,23 hours ago,음바페가 이강인을 유독 좋아하는 이유
404,뎀벨레 뻘짓거리 볼때마다 전성기 시절 공격수 차두리보는 기분이라 몹시 안타까움.돌파는 존나 빠른데 영점 안맞고,0,3 days ago (edited),음바페가 이강인을 유독 좋아하는 이유
405,눈이 내리는 추운날 촬영하시느라 고생하셨습니다 너무 재밌어요! 뾰~~옹~!,0,3 days ago,음바페가 이강인을 유독 좋아하는 이유
406,하 재밌네 이 친구 컨텐츠 좋네,0,3 days ago,음바페가 이강인을 유독 좋아하는 이유
407,맨유가 요즘 축구를 못하는 이유 알려주십쇼,0,3 days ago,음바페가 이강인을 유독 좋아하는 이유
408,이제 음바페랑 이강인 조금만 언쟁 생기면 음바페 내려치기 들어간다 ㅋ,0,18 hours ago,음바페가 이강인을 유독 좋아하는 이유
409,뎀벨레가 이 영상 포인트네 ㅋㅋㅋ,0,3 days ago,음바페가 이강인을 유독 좋아하는 이유
410,분석지리네요,0,2 days ago,음바페가 이강인을 유독 좋아하는 이유
411,05:50 킬포,0,3 days ago,음바페가 이강인을 유독 좋아하는 이유
412,뎀벌레 결국 못넣요애서 빵 ㅌ터짐,0,9 hours ago,음바페가 이강인을 유독 좋아하는 이유
413,내가 고윤정을 유독 좋아하는 이유,0,3 days ago,음바페가 이강인을 유독 좋아하는 이유
414,이현주 배준호 양현준  황재원 고영준등이  좋은 동료가 되줄기야.   뭐  황인범 황희찬 김민재랑  일단 월컵 두번은 더 조져줄거고,0,3 days ago,음바페가 이강인을 유독 좋아하는 이유
415,3:51 오늘의 킬포 ^^,0,3 days ago,음바페가 이강인을 유독 좋아하는 이유
416,밥도둑에게 밥상 잘 차려줘봐..크..,0,2 days ago,음바페가 이강인을 유독 좋아하는 이유
417,이강인만 보다보면 프레임 버그 일어남,0,2 days ago,음바페가 이강인을 유독 좋아하는 이유
418,왼발잡이 이강인 따라하려고 화면을 반전하셨네 ㅋㅋㅋㅋㅋ 디테일 칭찬해,0,3 days ago,음바페가 이강인을 유독 좋아하는 이유
419,음바페 레알 가지마!!!!!!!!!!!!!,3,3 days ago,음바페가 이강인을 유독 좋아하는 이유
420,불쌍하지도 않냐?,0,3 days ago,음바페가 이강인을 유독 좋아하는 이유
421,강인이도 레알 가자..,0,3 days ago,음바페가 이강인을 유독 좋아하는 이유
422,후뱅 디아스 분석 기원 4번째,1,3 days ago,음바페가 이강인을 유독 좋아하는 이유
423,두분 이쁜 사랑 하세요,1,3 days ago,음바페가 이강인을 유독 좋아하는 이유
424,이강인 내년에 음바페랑 같이 레알마드리드 동시 입성가능함?,1,3 days ago,음바페가 이강인을 유독 좋아하는 이유
425,깡패 ㅋㅋㅋㅋㅋㅋ,0,2 days ago,음바페가 이강인을 유독 좋아하는 이유
426,사람들은 토트넘 경기력 부진할때 공격수탓 수비탓만 하는데 호이비에르가 진짜 온갖 똥을 다 싸고 있다는걸 인지하지 못하는 인간들이 많더라...,0,3 days ago,음바페가 이강인을 유독 좋아하는 이유
427,거의 40대인데 진짜 친구같노 ㅋㅋㅋ 구독박고감 ㅋ,0,3 days ago,음바페가 이강인을 유독 좋아하는 이유
428,깡패라인 흥해라~,0,2 days ago,음바페가 이강인을 유독 좋아하는 이유
429,내가 김진짜를 남자로 보는 이유 ‍️‍,0,3 days ago,음바페가 이강인을 유독 좋아하는 이유
430,진짜행님이 음바페랑 이강인 벗겨먹는거 보니까 너무 재밌어요,0,3 days ago,음바페가 이강인을 유독 좋아하는 이유
431,요약:축구 잘해서,0,3 days ago,음바페가 이강인을 유독 좋아하는 이유
432,내일 중국전도 기대됩니다. 우레이와 우당탕탕 아이들,0,3 days ago,음바페가 이강인을 유독 좋아하는 이유
433,ㅋㅎㅋㅎㅋㅎ,0,3 days ago,음바페가 이강인을 유독 좋아하는 이유
434,이강인 대한민국 원탑 저번월드컵도 그렇코 지금도 이강인 발끝에서 시작댐 그리고 쏜은 수비수하나 못재끼는데 강인이는 그냥 메시마냥 미친드리블로 재껴버리고 덕배처럼 패스가진짜 세계최고임 이강인 너무잘해,0,3 days ago,음바페가 이강인을 유독 좋아하는 이유
435,와 이해 팍팍,0,2 days ago,음바페가 이강인을 유독 좋아하는 이유
436,"이강인선수는 이천수의 테크니컬 정확한 크로스의 기성용 오프더볼움직임의 박지성 ,활동성의 황인범 ,손흥민의 환한미소와 자신보다 팀을 위해 헌신하는 자세 가 합쳐졌네요.어린나이 빅클럽에서 주전으로 활약하는모습 멋있고다만 자만하지마시고 국대차기 7번 응원합니다.",0,9 hours ago,음바페가 이강인을 유독 좋아하는 이유
437,8:48 장난기가 오지게 많나봐요 개웃기넼ㅋ,0,3 days ago,음바페가 이강인을 유독 좋아하는 이유
438,강인이는 연하고 부드러우니까....^^,0,1 day ago,음바페가 이강인을 유독 좋아하는 이유
439,제발 급발진만 안하면 좋을텐데...전에 라모스 발목 때리는거 보면 욱하는게 있는거같음,0,1 day ago,음바페가 이강인을 유독 좋아하는 이유
440,진짜님 요즘 너무 느끼는게 국뽕 유튜버 같습니다 솔직히 파리의 다른 선수들도 할수 있는 부분을 이강인선수만 할수 있다는 식으로 말하는게 국뽕 유튜버같습니다 다른 유튜버는 이강인선수의 단점 또한 말하지만 너무 응원만 하시는거 같아요 ,0,3 days ago,음바페가 이강인을 유독 좋아하는 이유
441,핡핡 이런 영상을 원했어!!!,0,3 days ago,음바페가 이강인을 유독 좋아하는 이유
442,진짜형5분50초말하는거 진짜 딱쏜임ㅋㅋㅋ 동료들 쏜 하는거보면개빡침 줄땐안주고 슛팅때리니 또 패스도 퀄리티가 너무낮아 패스도잘못해서 ㅋㅋ동료들개빡침 그러니 동료들 불화설 끊이질않음,0,3 days ago (edited),음바페가 이강인을 유독 좋아하는 이유
443,이 형도 간헐적 단식하나 살 쪽빠졌네 ㅋㅋㅋ,0,3 days ago,음바페가 이강인을 유독 좋아하는 이유
444,형님 그리즈만 해주세용,1,2 days ago,음바페가 이강인을 유독 좋아하는 이유
445,아니 뎀벨레가 겁나 웃기네,0,3 days ago,음바페가 이강인을 유독 좋아하는 이유
446,7:47 ㅋㅋㅋㅋㅋㅋㅋㅋㅋㅋㅋㅋ,0,1 day ago,음바페가 이강인을 유독 좋아하는 이유
447,강인이 젊어서 햄스 버티는데 나이들면 안남아날듯.. 드리블 모션 좀 고쳐야 될꺼 같음,0,3 days ago,음바페가 이강인을 유독 좋아하는 이유
448,발렌시아 고맙다고.....,1,2 days ago,음바페가 이강인을 유독 좋아하는 이유
449,이강인 이민형 이상혁 let's go,0,3 days ago,음바페가 이강인을 유독 좋아하는 이유
450,지리게 설명 잘해~,0,3 days ago,음바페가 이강인을 유독 좋아하는 이유
451,참 재밌게 말 잘해.. ㅋ,0,3 days ago,음바페가 이강인을 유독 좋아하는 이유
452,깡페조합  굳,0,2 days ago,음바페가 이강인을 유독 좋아하는 이유
453,그냥 밥상차려주니까 고마운 거지 뭘 어렵게 말하나 ㅋㅋㅋ,2,3 days ago (edited),음바페가 이강인을 유독 좋아하는 이유
454,이게 쉽게 롤로만 비유해봐도아무리 모르는사람이랑 봇듀오할떄 원딜 해보면 티어가 더높고 낮고를 떠나서어? 이사람 서폿좀하네?  이런 사람이있음 한타때도 나만봐주고 내가 못본것도 다 봐서 살려주고나랑 척하면 척 내상각이랑 들어맞고 내가원하는 플레이항상 준비되어있고,0,3 days ago (edited),음바페가 이강인을 유독 좋아하는 이유
455,음바페 취향이 독특하지 않나... 강인아 조심하자.,0,21 hours ago,음바페가 이강인을 유독 좋아하는 이유
456,뮐러형 오랜만이야...,1,1 day ago,음바페가 이강인을 유독 좋아하는 이유
457,진짜형 살빠졌네,0,3 days ago,음바페가 이강인을 유독 좋아하는 이유
458,손흥민이 비호감인 이유 make the run,3,3 days ago (edited),음바페가 이강인을 유독 좋아하는 이유
459,와 군포는 눈이 엄청 많이 왔네요,1,3 days ago,음바페가 이강인을 유독 좋아하는 이유
460,꿈보다 해몽이네,0,3 days ago,음바페가 이강인을 유독 좋아하는 이유
461,칸진리 ,0,3 days ago,음바페가 이강인을 유독 좋아하는 이유
462,헐 형님 영상보다보니 오늘 참조영상으로 뛰는 모습 배경이.. 혹시 교통대인가요?? 너무 낯이익는데...,0,3 days ago,음바페가 이강인을 유독 좋아하는 이유
463,음단장님...!,0,2 days ago,음바페가 이강인을 유독 좋아하는 이유
464,음바페 너도 네이마르처럼 떠날거잖아!! 왜 플러팅 했오!!,2,3 days ago,음바페가 이강인을 유독 좋아하는 이유
465,음바페에게 동양인 인종차별 안당하고커플로 지낼 줄 누가 알았겠나요,0,2 days ago,음바페가 이강인을 유독 좋아하는 이유
466,나도 진짜님이 참~~ 좋아요~~~^^,0,2 days ago,음바페가 이강인을 유독 좋아하는 이유
467,7:47 덤벨레 ㅋㅋㅋ,1,3 days ago,음바페가 이강인을 유독 좋아하는 이유
468,숨 쉬듯이 덤벨레혐오 ㅋㅋㅋㅋㅋㅋ,0,3 days ago,음바페가 이강인을 유독 좋아하는 이유
469,4:31 노이어 뭐 킥오프 하러 나온건가...? ㅋㅋㅋㅋㅋㅋㅋ,0,2 days ago,음바페가 이강인을 유독 좋아하는 이유
470,나 음바페. 한글 배운다. 강인 존나 좋다,0,3 days ago,음바페가 이강인을 유독 좋아하는 이유
471,이 정도면 캡틴 쯔바사 아니냐..,0,3 days ago,음바페가 이강인을 유독 좋아하는 이유
472,음바페  수비똥받이 이게  나중에 이강인선수한테  좋을거라는거 좀 위로되네,3,3 days ago,음바페가 이강인을 유독 좋아하는 이유
473,진짜형 국뽕티비 되기로 한거야?,6,3 days ago,음바페가 이강인을 유독 좋아하는 이유
474,ㅋㅋㅋㅋㅋㅋㅋㅋㅋㅋㅋㅋㅋㅋㅋㅋㅋ ㅇㅈ 미치겟다,0,3 days ago,음바페가 이강인을 유독 좋아하는 이유
475,뎀벨레ㅋㅋㅋㅋㅋㅋ,0,2 days ago,음바페가 이강인을 유독 좋아하는 이유
476,발렌시아에서 온갖 인종차별과 업신여김을 당해서 살아남는 법을 제대로 배웠지 ㅋㅋㅋ,0,3 days ago,음바페가 이강인을 유독 좋아하는 이유
477,알았다! 뎀밸레 요놈!!,0,2 days ago,음바페가 이강인을 유독 좋아하는 이유
