,comment,like,time,title_list
0,수험생 여러분 고생 많으셨습니다!! 새내기 필수템 살 땐 갤럭시로 시작!11월에 진행 중인 다양한 프로모션들과 수험생만 누릴 수 있는 수험생 특별 프로모션까지!다양하게 준비되어 있으니 다양한 혜택 절대 놓치지 마세요! https://www.samsung.com/sec/event/galaxymobile/csatpromotion,704,5 days ago,대학 갈 거야?
1,ㄷㄷ,0,5 days ago,대학 갈 거야?
2,예,0,5 days ago,대학 갈 거야?
3,광고는 킥이죠,1,5 days ago,대학 갈 거야?
4,삼전에게 광고ㄷㄷ,2,5 days ago,대학 갈 거야?
5,님아 워치6클래식 혜택은 없는데여?,0,5 days ago,대학 갈 거야?
6,아이폰 쓸거양,1,4 days ago,대학 갈 거야?
7,아 이편은 진짜 너무 댕웃긴데 ㅋㅋㅋㅋㅋㅋㅋㅋ저때 대학생 한명이면 대학교들 이미 망한거아닙니깤ㅋㅋㅋㅋㅋㅋㅋㅋㅋㅋ자기가 갈 대학교 문자투표 진짜 뭐얔ㅋㅋㅋ,2K,5 days ago,대학 갈 거야?
8,학교가 크면 뭐해 ㅋㅋㅋㅋ,3,5 days ago,대학 갈 거야?
9,근데 댕웃기다는말은 요즘말이에여? 진짜 할머니라 몰라서..,3,5 days ago,대학 갈 거야?
10, @asdf-gx2gr 구라 ㄴ,4,5 days ago,대학 갈 거야?
11,댕X 멍O,1,5 days ago,대학 갈 거야?
12, @asdf-gx2gr 개웃기다는 말 저렇게 쓰는거같은데 저도 할미라 볼때마다 이질감듦ㅋㅋㅋㅋㅋㅋ,1,5 days ago,대학 갈 거야?
13,등록금이 수천만원되것지요ㅋ,0,4 days ago,대학 갈 거야?
14, @saliswhenout 카톡하다보면 그 사람이 쓰는 단어 말투에서 나이가 그대로 보임 ㅋㅋ 40대초반 형 누나들이랑 카톡하면 진짜 옛날 채팅방 말투 그대로 쓰더라고 아직까지,0,4 days ago,대학 갈 거야?
15,댕웃긴데 이지랄 싸대기 마렵노ㅋㅋ,1,2 days ago,대학 갈 거야?
16,댕웃기다는거 쓴지 좀 됨.개웃기다=멍웃기다=댕웃기다처음본게 15년도인가,1,2 days ago (edited),대학 갈 거야?
17,웃기다기 보다는 웃프다...,0,1 day ago,대학 갈 거야?
18,이쯤되면 학과 통합보다 학교를 통합해야 하는거 아니냐구요 ㅋㅋㅋㅋㅋㅋ,3.5K,5 days ago,대학 갈 거야?
19,통합 1개만 남을듯.,59,5 days ago,대학 갈 거야?
20,각 광역시 대학교랑 도립대학교 하나씩만 남기면될듯ㅋㅋㅋㅋㅋㅋ,108,5 days ago,대학 갈 거야?
21,이쯤되면 한국이라는 나라가있을까 ㅋㅋㅋ,31,5 days ago,대학 갈 거야?
22,실제로 대학 통합 사업? 이 이루어지고 있습니다,43,5 days ago,대학 갈 거야?
23,귀하신 학생분들 발 아프지 마시라고 그대로 두는 거랍니다~ 기름값도 아끼는 출산 장려 정책입니다~,5,5 days ago,대학 갈 거야?
24,"20년 뒤면... 서울 소재 4년제, 지거국 제외하면 멸망할듯",9,5 days ago,대학 갈 거야?
25,이미 대학교 통합은 진행중입니다~~,5,5 days ago,대학 갈 거야?
26,서연고대학교 ㅋㅋㅋㅋ,0,5 days ago,대학 갈 거야?
27,그런데 그 일이 실제로 일어나고 있읍니다,3,5 days ago,대학 갈 거야?
28,이미 통합 진행중이죠..ㅋㅋ 글로컬인지 뭔지,4,5 days ago,대학 갈 거야?
29,진호님 듣는연기 개웃기다 ㅋㅋㅋㅋㅋㅋㅋㅋㅋㅋㅋㅋㅋ 광고도 자연스럽게 잘 녹이셨고 오늘도 뇌절의 뇌절까지 발상 신선하네요 ㅋㅋㅋㅋㅋ 총장들이 모여서 학생한명 모셔가는 상황 ㅋㅋㅋㅋㅋㅋㅋㅋㅋㅋㅋ,1.1K,5 days ago,대학 갈 거야?
30,지져스,64,5 days ago,대학 갈 거야?
31,초저출산 시대에 살아남은 대학들도 진짜 대단하네요 이번편은 그냥 웃기기만 한게 아니라 생각할게 많아지는 예술작품이네요,761,5 days ago,대학 갈 거야?
32,유툽가업도 댕웃긴데 입시 설명회가 진짜 신박하당ㅋㅋㅋㅋㅋ,549,5 days ago,대학 갈 거야?
33,이번편은 진짜 완전 박시온 대학 입시설명회ㅋㅋㅋ꼭 쇼미더머니와 프로듀스 보는줄ㅋㅋㅋㅋㅋㅋㅋ유튜브 가업에 캣타워 빌라ㅋㅋㅋ,173,5 days ago (edited),대학 갈 거야?
34,ㅋㅋㅋㅋㅋㅋㅋㅋㅋㅋㅋㅋㅋㅋㅋㅋㅋㅋ감사합니당,3,2 days ago,대학 갈 거야?
35,아 박시온 입시설명회라고 할때 개크게 웃었네 이건 생각못했닼ㅋㅋㅋㅋ최종 결승 생방송 문자투표 돌았냐고ㅋㅋㅋ얼마나 학생수가 없으면ㅋㅋㅋㅋㅠㅠㅠㅠ,169,5 days ago,대학 갈 거야?
36,세절대학교 총장님 딕션이랑 내용 딜리버리가 확실하네요아 한국대학교 캣타워도 너무 좋은데 진짜 고민 된다..,341,5 days ago,대학 갈 거야?
37,개그우먼 이현정 그녀는 도덕책,35,5 days ago,대학 갈 거야?
38,흐음...세전대학 가야지,3,5 days ago,대학 갈 거야?
39,킥서비스 망영리까지 싹다 신선하고 재밌는데 이번편은 진심 2032 감성카페편 처음 볼때만큼의 충격이 ㅋㅋㅋ진짜 천재들이네요️,114,5 days ago (edited),대학 갈 거야?
40,킥서비스는 매 영상 아이디어로만 승부해서 너무 재밌게 잘 보고 있습니다.다른 스케치코메디 채널들은 시간이 지나니 결국 한계가 보이던데 킥서비스는 계속 발전하는 것 같아요.,46,5 days ago,대학 갈 거야?
41,정말 킥서비스 구독자 2만명때부터 봤는데 그땐 이런 고퀄리티 영상이 왜 조회수가 안나오나 나만 알기 넘 아깝다고 생각했어요 지금은 대형 채널로 성장하는 모습을 보니 제가 더 뿌듯하네요,20,4 days ago,대학 갈 거야?
42,와.. 이번 편 진짜 레전드다...  생각을 다 뒤집었어..,168,5 days ago (edited),대학 갈 거야?
43,아니 박시온 입시설명회에서 저항없이 터졌네 ㅅㅋㅋㅋ,1.6K,5 days ago,대학 갈 거야?
44,ㅏ스포 ㅠㅜ,9,5 days ago,대학 갈 거야?
45,진짜 상상도 못했다 저출산을 이렇게 표현하다니,101,5 days ago,대학 갈 거야?
46,뭔 상황인지 파악하는데 10초 걸림ㅋㅋㅋㅋㅋㅋ 개참신하네,90,5 days ago,대학 갈 거야?
47,ㄹㅇㅋㅋㅋ,6,5 days ago,대학 갈 거야?
48,무슨 야구선수 드래프트 하듯이 ㅋㅋㅋㅋㅋ,16,5 days ago,대학 갈 거야?
49,2010년대: 대학을 왜안가?2030년대: 대학을 왜가?,10,5 days ago,대학 갈 거야?
50,초전도체임?,0,2 days ago,대학 갈 거야?
51,"은꼴,억지개그 없이 아이디어로만 승부하는 킥서비스 화이팅입니다",451,5 days ago,대학 갈 거야?
52,누구 저격인가요,0,4 days ago,대학 갈 거야?
53," @user-fr4xc7jh3n  많잖아요 야시꾸리한 사진 썸네일 올리고 의무방어전,여사친유혹 이런걸로 어그로 끄는거",48,4 days ago,대학 갈 거야?
54,어떻게보면 개억지개그가 뇌절의 뇌절을 거듭해서 재밌어졌음ㅋㅋㅋㅋㅋ,0,2 days ago,대학 갈 거야?
55,수험생분들 시험 결과 좋으시길 바래요~ 지금까지 수고했으니 쉬엄쉬엄 하세요ㅋㅋ 꽃길만 걸읍시다,146,5 days ago,대학 갈 거야?
56,킥서비스 진짜 볼 때마다 기대 이상이라 넘 대단합니다. 예상을 뛰어넘어 뇌절까지 가는 게 진짜 웃겨요 ㅋㅋㅋㅋㅋ,12,4 days ago,대학 갈 거야?
57,한국대학교 총장님 1차 붙었을 때 연기 너무 잘하시네ㅋㅋㅋ,432,5 days ago,대학 갈 거야?
58,진짜 뇌절의 끝판왕ㅋㅋㅋ대학 입학혜택 축제 초대가수 선택권은 좀 끌린다ㅋㅋㅋ,45,5 days ago (edited),대학 갈 거야?
59,아닠ㅋㅋㅋㅋㅋㅋㅋ캣타웤ㅋㅋㅋㅋㅋ한국대 총장님 야무지게 준비하셨넼ㅋㅋㅋㅋㅋㅋㅋㅋㅋㅋ이거 2편 주나옄ㅋㅋ시온이 대학 어디가는지 보고 싶은뎈ㅋㅋㅋ,145,5 days ago,대학 갈 거야?
60,오디션 감상하는 표정연기가 예술 ㅋㅋㅋㅋ,60,5 days ago,대학 갈 거야?
61,쇼미 프로듀서 그 자체ㅋㅋㅋㅋㅋ,1,5 days ago,대학 갈 거야?
62,그동안 모아왔던 뇌절과 광고의 향연.. 킥서비스 채널의 정수 그자체,19,5 days ago,대학 갈 거야?
63,이번편 진짜 잘 만드셨다 ㅋㅋㅋ,74,5 days ago,대학 갈 거야?
64,갈수록 ㄹㅇ 컨텐츠가 재밌어지네 ㅋㅋㅋㅋㅋㅋㅋㅋㅋㅋㅋㅋㅋ 역시 개그맨들은 똑똑해. 유튜브가 개그맨들 끼를 살려주네,13,4 days ago,대학 갈 거야?
65,"이집 개그가 나는 좋음, 다른개그채널들은 너무 부부소재만 다뤄서 그나물에 그밥이더라구, 2033 아이덴티티가 너무 재미있음",230,5 days ago,대학 갈 거야?
66,"ㄹㅇ 다 인터넷 커뮤, 밈 적당히 주워쓰는 느낌이면여기는 자기만의 색깔로 더 가공하는 느낌",51,5 days ago,대학 갈 거야?
67,맞아요 다른건 다 여자 옷벗기고 어그로 끌고 식상하다면 여긴 진짜 매번 아이디어가 놀랍고 한편한편 정성이 대단한거같습니다,29,5 days ago,대학 갈 거야?
68,ㄹㅇ 다들 초반엔 재밌다가도 나중엔 선정적인 걸로 어그로 끌어서 별로임,4,5 days ago,대학 갈 거야?
69,이번편 신박하다 ㅋㅋㅋ서울 소재 대학에서 버즈랑 갤워치 주면서 나 모셔간다하면 바로감ㅋㅋㅋㅋ,54,5 days ago,대학 갈 거야?
70,아이디어 미쳤네 진짜 ㅋㅋㅋㅋㅋㅋㅋㅋㅋㅋ컨텐츠가 끊임없이 나오네,69,5 days ago,대학 갈 거야?
71,ㅋㅋㅋㅋㅋ 아니 시온이 예선 들을때 묘하게 킹받는 표정 어쩔껀데 ㅋㅋㅋ,30,5 days ago,대학 갈 거야?
72,이번편 진짜 잘만들었다 ㅋㅋㅋ,46,5 days ago,대학 갈 거야?
73,역시 광고를 그냥 안하고 입시설명회로하는 킥서비스 굿,30,5 days ago,대학 갈 거야?
74,"아공~~♡ 시온이 돌잔치 잠실주경기장에서 했을 때 암표 200에 겨우 구해서 직관했던 기억이 새록새록,,, ,ㅠㅠ 벌써 대학 갈 나이가 됐구나 ㅜㅜ 세금 많이내는 어른으로 무럭무럭 자라렴",14,5 days ago,대학 갈 거야?
75,헐 그때 시온이엄마가 암표 다 잡았었는데,0,2 days ago,대학 갈 거야?
76,결승전에서 웃겨서 숨멎을 뻔 ㅋㅋㅋㅋㅋㅋㅋㅋ,43,5 days ago,대학 갈 거야?
77,박시온 입시설명회 보자마자 저항없이 터졌네 ㅋㅋ,40,5 days ago,대학 갈 거야?
78,그렇게 플립플립 외치더니 삼성의 지원도 받고 정말 삼갤무량하네요킥서비스 언제나 삼승장구하길!,12,5 days ago,대학 갈 거야?
79,삼갤무량ㅋㅋㅋㅋㅋㅋㅋㅋㅋㅋㅋ,1,2 days ago,대학 갈 거야?
80,주객전도가 무엇인지 확실히 알려주는 영상 ㅋㅋㅋㅋ,10,5 days ago,대학 갈 거야?
81,이번편 진짜 레전드네ㅋㅋㅋㅋㅋㅋㅋㅋㅋㅋㅋㅋㅋㅋㅋㅋ 진짜 댕웃기다,4,4 days ago,대학 갈 거야?
82,진짜 개그맨들은 머리도 좋다고 생각드네요 항상 재미있게 잘보고있습니다 웃게해줘서 고마워요ㅎ,11,5 days ago,대학 갈 거야?
83,학과 통합되는 거 ㅋㅋㅋㅋㅋㅋㅋㅋㅋㅋㅋㅋㅋㅋㅋㅋㅋㅋㅋㅋㅋㅋㅋㅋㅋ겁나 웃기네요,93,5 days ago (edited),대학 갈 거야?
84,ㅋㅋㅋㅋㅋㅋㅋㅋㅋㅋㅋ 아 설명들으면서 리듬타는 표정 킹받아욬ㅋㅋㅋㅋㅋ 왜  시온이 너가 갈 대학을 문자로 투표하는건뎈ㅋㅋ,1,1 day ago,대학 갈 거야?
85,ㅋㅋㅋㅋㅋㅋㅋ진짜 어떻게 이렇게 계속 아이디어가 나오지...? 아놔 박시온 입시설명회라닠ㅋㅋㅋㅋ,2,3 days ago,대학 갈 거야?
86,아 진짜 웃겨죽는줄 ㅋㅋㅋㅋ 광고도 이렇게 자연스럽게 하는건 킥서비스밖에 없는듯 ㅋㅋㅋ,3,5 days ago,대학 갈 거야?
87,와 이번편 진짜 봤던 편들 중에 젤 웃김 ㅋㅋㅋㅋㅋㅋ,4,5 days ago,대학 갈 거야?
88,호우 이러면서 추임새넣는거 진짜 킹받는데 너무 웃기고 저출산 잘표현했어요 ㅠㅠ어이없어 그냥,5,5 days ago,대학 갈 거야?
89,킥서비스 아이디어 하나같이 기깔나서 결국 구독함~~ 뇌절을 담백하게 표현해서 좋아유,5,5 days ago (edited),대학 갈 거야?
90,아 이번에 진짜 웃겼다ㅋㅋㅋㅋㅋㅋ뇌절의 뇌절의 뇌절ㅋㅋㅋㅋㅋㅋㅋㅋㅋ,5,4 days ago,대학 갈 거야?
91,대학을 이상형월드컵으로 가는 세상,3,5 days ago,대학 갈 거야?
92,10년 전 편도 만들어주세요!,0,1 day ago,대학 갈 거야?
93,뇌절 돌았네 진짜 ㅋㅋㅋㅋㅋㅋㅋㅋㅋㅋㅋ,11,5 days ago,대학 갈 거야?
94,인구문제는 어떻게 볼때 마다 매번 재밌네요 뭔가 미래에 대한 불안을 좀 달래주는거 같아요,6,5 days ago,대학 갈 거야?
95,아 진짜 웃겨서 미칠것같음ㅁㅌㅋㅋㅋㄴㅌㄴㅋㅋㅋㅋㅋㅋㅋㅌㅋㅋㅋㅋㅋㅋㅋㅋㅋㅋㅋㅋㅋㅋㅋㅋㅋㅋㅋㅋ쇼미 평가하는것같ㅇ늠ㅋㅋㅋㅋㅋㅋㅋㅋㅋㅋㅋ,2,2 days ago,대학 갈 거야?
96,수험생 분들 고생 많으셨습니다!!,1,5 days ago,대학 갈 거야?
97,광고를 제일 자연스럽게 잘 녹여내는 유투버 1위 킥서비스,5,5 days ago,대학 갈 거야?
98,개그맨들은.... 참 대단해 ㅋㅋㅋㅋㅋ,1,1 day ago,대학 갈 거야?
99,이번편은 레전드다ㅋㅋㅋ,6,5 days ago,대학 갈 거야?
100,아니 저정도면 대학 다 문닫는거 아니냐고요ㅋㅋㅋ 참고서에서 터짐  ㅋㅋㅋ라떼는 책걸이 한다고 과자파티 하고 했는데 ㅎㅎ 옛날이야기네 ㅋ,9,5 days ago,대학 갈 거야?
101,이번껀 간만에 역대급 뇌절 댕정합니다ㅋㅋ,3,5 days ago,대학 갈 거야?
102,"이제 ""수험생 여러분 화이팅하세요"" 가 아니라 ""총장님 여러분 화이팅하세요"" 가 되버렷다",28,5 days ago,대학 갈 거야?
103,구독자 64만이라니... 640만 정도의 퀄리티~~~ 제 마음속엔 숏박스와 공동1위 입니다   ,6,5 days ago,대학 갈 거야?
104,나이 잇는 분들 연기 많이 볼 수 있는 것도 좋다 ㅋㅋㅋ,8,5 days ago,대학 갈 거야?
105,다가올 미디어 통제에 대비해 영상에 삼전유로광고를 끼워넣은게 레전드넼ㅋㅋㅋㅋㅋㅋ,6,5 days ago (edited),대학 갈 거야?
106,ㅈㄴ 신박하고 내용이랑 잘 맞아서 광고 다 봄ㅋㅋㅋㅋ,2,5 days ago,대학 갈 거야?
107,지진 때 교과서 찾기가 꿀잼이지ㅋㅋㅋㅋㅋ,2,5 days ago,대학 갈 거야?
108,이어받아야할 가업이 유튜브 ㅋㅋㅋㅋㅋㅋㅋㅋㅋㅋㅋㅋ,116,5 days ago,대학 갈 거야?
109,"""제로투""부터 시작하는 승계작업ㅋㅋㅋ",7,5 days ago,대학 갈 거야?
110,갑자기 든 생각인데 진호님이 이안시누 편하게 죽는방법 3가지 따라해주셨으면 좋겠어요 개웃길 것 같음,1,2 days ago,대학 갈 거야?
111,ㅋㅋㅋㅋㅋㅋㅋㅋㅋㅋㅋㅋㅋㅋㅋ아 진짜 킥서비스 완벽하다! 혜자스러운 서비스다! 어떻게 이런 아이디어를 가져오지,1,15 hours ago,대학 갈 거야?
112,ㅋㅋㅋㅋㅋㅋㅋㅋㅋㅋㅋ 진짜 너무 웃겨요 사랑해요 킥서비스,1,5 days ago,대학 갈 거야?
113,"저희 대학교에 오시면 자택으로 직접 교수님이 방문, 교육하러 가십니다.교육부장관님의 방문 축사도 있을 계획입니다~~",51,5 days ago,대학 갈 거야?
114,"아이디어 진짜 ㅋㅋ 마냥 웃을수만은 없는게 옆나라에서도 인구절벽이후 실제 사회적 문제가 되서 외국인들 계속 영입하며 다문화 국가로 가고있다는 영상 얼마전에 봤는데 실제 일본에서도 신입사원이 회사 고르는 게 현실화 된 영상도 본적 있고.. 지금도 이미 우리나라에서 초등학교부터 강원도 한 학교 입학생 1명 뉴스까지 나오니.. 재밋게 봤는데  실제로 일어날것같은 느낌도 드는 ㄷㄷ 그리고 아쉬운건 삼성 지원이라고 처음에 나와서 ppl인건 알겠지만 최근 미는 제품이 저때 먹힐리가 없는데.. 차라리 워치6 10세대 라든지, 원래 하던느낌이 아니라 어짤수없는건 알지만 조금 아쉽긴하네요",1,5 days ago,대학 갈 거야?
115,창의력 미쳤다 인정??ㅋㅋㅋㅋㅋㅋㅋㅋㅋㅋㅋㅋㅋ,53,5 days ago (edited),대학 갈 거야?
116,광고를 이렇게풀다니!! 정말 아이디어 천재신듯!! 존경합니다 개그맨분들!!!,0,4 days ago,대학 갈 거야?
117,ㅋㅋㅋㅋㅋㅋㅋㅋㅋㅋ하 씨 쇼미더머니1차마냥 입시를 치룰줄은 상상고 못했닼ㅋㅋㅋㅋㅋㅋㅋㅋㅋㅋㅋㅋㅋㅋㅋㅋㅋㅋㅋ,3,4 days ago,대학 갈 거야?
118,진짜 킥서비스가 제일 웃겨요 사랑해요,1,5 days ago,대학 갈 거야?
119,아ㅋㅋ 쇼미더머니야 뭐야ㅋㅋㅋ아...진짜 이 채널 대박 웃기게 만드네개그콘서트 필요없다ㅋㅋㅋㅋ,1,4 days ago,대학 갈 거야?
120,캣타워 드리프트 미쳤네ㅋㅋ관록에서 엿볼 수 있는 임기응변이였다.,0,2 days ago,대학 갈 거야?
121,취미로 소설이나 영화 각본도 내주세요 ㅠㅠㅠㅠ,0,4 days ago,대학 갈 거야?
122,매번 진짜 생각도 못한게 나오네ㅋㅋㅋ,0,5 days ago,대학 갈 거야?
123,이번편은 정말 웃푸다라고 해야될거같네요...인구감소.. ㅜㅜ,3,5 days ago,대학 갈 거야?
124,진짜 아이디어 참신하다 ㅋㅋㅋㅋㅋㅋㅋㅋㅋㅋ,2,2 days ago,대학 갈 거야?
125,참기발하십니다.ㅎㅎ엄청들 노력하시는게다보여용,2,5 days ago,대학 갈 거야?
126,시작부터 뇌절 ㅋㅋㅋㅋㅋ 너무 웃겨요,1,5 days ago,대학 갈 거야?
127,뇌절을 예술의 경지로 끌어올린 킥서비스,2,2 days ago,대학 갈 거야?
128,됐슈.. 그냥 가유..아.. 이 대사가 난 왜그리 짠하냐.. ㅋㅋㅋㅋㅋ,2,4 days ago,대학 갈 거야?
129,"아니...다들 액면가는 이미 대학, 군대, 예비군까지 마치고 든든한 가정도 있을거 같구만ㅋㅋㅋㅋㅋㅋ",1,5 days ago,대학 갈 거야?
130,정곡,0,2 days ago,대학 갈 거야?
131,비닐 잡는거 ㅋㅋㅋㅋㅋ장기자랑으로 따라하기 좋다,2,5 days ago,대학 갈 거야?
132,개웃기넼ㅋㅋㅋㅋㅋㅋㅋㅋㅋㅋ 아니 이번편은 어르신들이 다했닼ㅋㅋ,1,1 day ago (edited),대학 갈 거야?
133,지방대총장님 잘하셔서 몇번이나 돌려봄ㅋ,2,5 days ago,대학 갈 거야?
134,와 진짜 한계가 어디인가 ㅋㅋㅋ,0,5 days ago,대학 갈 거야?
135,저정도면 개인 입시 설명회가 아니라 학생들 단체로 입시 박람회를 여는게 나을거 같은데 ㅋㅋㅋㅋㅋㅋ총장님들이 막 돌아다니면서 학생들 설명 듣고 ㅋㅋㅋ,2,5 days ago,대학 갈 거야?
136,와웅 쇼미와 프듀가 합쳐진 입시설명회넼ㅋㅋㅋ,16,5 days ago,대학 갈 거야?
137,ㅋㅋㅋㅋㅋㅋㅋㅋㅋㅋㅋ 왤케..현실로 될까봐.. ..슬프지..흑흑,3,5 days ago,대학 갈 거야?
138,와... 진짜 아찔하다 웃기긴한데 인구감소때문에 진짜 .... 이렇게 될까봐... ㄷ..,11,5 days ago,대학 갈 거야?
139,진짜매주기다려요ㅜ제웃음벨ㅜㅜㅜ일주일에7개씩올려주셨음좋겠다ㅜㅜ,0,5 days ago,대학 갈 거야?
140,상상력 천재들! 진짜 진짜 최곱니다~,1,5 days ago,대학 갈 거야?
141,ㄹㅇ 아이디어가 끝이없네ㅋㅋㅋㅋ,1,5 days ago,대학 갈 거야?
142,진짜아이디어미쳤냐고ㅋㅋ삼성지원받으니클라스달라짐,1,3 days ago,대학 갈 거야?
143,리듬타는거 개웃기면서 개열받네 ㅋㅋㅋㅋㅋㅋㅋㅋㅋ,0,1 day ago,대학 갈 거야?
144,화장실에서 이어폰 끼고 볼일보고 있었는데 입시설명회에서 개뿜어서 선임한테 오해받음 ㅋㅋ,0,5 days ago,대학 갈 거야?
145,ㅋㅋㅋㅋ 진짜 개신박하다 ㅋㅋㅋㅋ ㅈㄴ 재밌음,2,2 days ago,대학 갈 거야?
146,현시점 에서 반대가 되는 시점이라서반전이긴 하네요 ,0,5 days ago,대학 갈 거야?
147,킥서비스 진짜 최고 ㅠ.ㅜ,1,4 days ago,대학 갈 거야?
148,이번 최고 계속터짐 ,0,1 day ago,대학 갈 거야?
149,1:27 아이고 내저럴줄 아라따!!!!! 경상권 대학총장님 탈락ㅋㅋㅋㅋㅋㅋㅋㅋㅋㅋㅋㅋㅋㅋㅋㅋㅋㅋㅋㅋㅋㅋㅋㅋㅋㅋㅋ,4,5 days ago (edited),대학 갈 거야?
150,아니 이거 진짜 웃김 오아.. 아이디어 미쳐버렸 ㅋㅋㅋㅋㅋㅋㅋㅋㅋㅋㅋㅋㅋㅋ,1,5 days ago,대학 갈 거야?
151,너무 현실적이라 웃프네 ㅋㅋ,2,1 day ago,대학 갈 거야?
152,아 진짜 이번 거는 댓글을 안 달 수가 없다 ㅋㅋㅋ 개웃겨요,1,5 days ago,대학 갈 거야?
153,이번것도 신박함ㅋㅋㅋㅋㅋㅋㅋㅋㅋㅋㅋㅋㅋ,2,5 days ago,대학 갈 거야?
154,저런 세상이 와서 나도 서울대 꽁으로 갈수있었으면 좋겠다.....,12,5 days ago,대학 갈 거야?
155,저정도의 세상이면 한국은 이미 지옥입니다....생각 조금만 더 잘해보세요,22,5 days ago,대학 갈 거야?
156,지방대는 20년 전부터 이미 교수들이 고등학교 돌면서 학생들한테 학교 설명하는 영업활동 하고 다녔다 ㅋㅋㅋ,8,5 days ago,대학 갈 거야?
157,서울대가 꽁일 정도면 이미 나라가 망한거지 ㅡㅡ,0,5 days ago,대학 갈 거야?
158,이번편 진짜 레전듴ㅋㅋㅋㅋ,1,4 days ago,대학 갈 거야?
159,이게 근데 진짜 불가능할 미래가 아닐지도 모른다는게 참 ㅋㅋㅋ,4,5 days ago,대학 갈 거야?
160,ㅋㅋㅋㅋㅋㅋ 이게 뭐야ㅋㅋㅋㅋㅋ 항상 웃음 주셔서 감사합니다,1,5 days ago,대학 갈 거야?
161,이게 뇌절이 아니면 뭐가 뇌절인데 ㅋㅋㅋㅋㅋㅋㅋㅋ 역시 뇌절은 예술이야!!,0,5 days ago,대학 갈 거야?
162,입시 역전세계 미쳤나ㅋㅋ,0,5 days ago,대학 갈 거야?
163,와 진짜 레전드 중 레전드 진짜 아이디어 대박이다,1,3 days ago,대학 갈 거야?
164,새내기 대학생에 취급은 어떨지 궁금해지는구만...,0,5 days ago,대학 갈 거야?
165,어이없어서 개좋아ㅋㅋㅋㅋㅋㅋㅋㅋㅋㅋ,1,5 days ago,대학 갈 거야?
166,"시대관통, 패러디, 개그.삼위일체 그자체",1,4 days ago,대학 갈 거야?
167,씁쓸함을 개그로 승화시킨 ㅋㅋ2050년이면 진짜 대학교 반은 없어진다.,12,5 days ago,대학 갈 거야?
168,ㅋㅋㅋㅋㅋㅋㅋㅋㅋㅋㅋㅋㅋㅋㅋㅋㅋㅋㅋㅋㅋㅋㅋㅋㅋ진짜웃기네,0,3 days ago,대학 갈 거야?
169,진짜 뒤지게 웃기네 ㅋㅋㅋㅋㅋ,1,4 days ago,대학 갈 거야?
170,진짜 대단하네 킥유니버스 ㅋㅋㅋㅋㅋㅋ,3,5 days ago,대학 갈 거야?
171,나는 시온이 하율이 이름 말랑말랑한게 현실적이고 너무 웃김 ㅋㅋㅋㅋㅋㅋㅋㅋ,2,5 days ago,대학 갈 거야?
172,아이디어 너무 좋아 진짜 ㅋㅋㅋ,0,5 days ago,대학 갈 거야?
173,2033년 시리즈 내년에도 계속하나요? 재밌는데ㅋㅋ,3,5 days ago,대학 갈 거야?
174,와 이번영상 개신박하네ㅋㅋㅋㅋㅋ 저출산 때문에 대학오디션 보는구나 ㅋㅋㅋㅋㅋ,1,5 days ago,대학 갈 거야?
175,ㅋㅋㅋㅋ너무 웃겨요ㅋㅋㅋ천재에요,0,5 days ago,대학 갈 거야?
176,아빠 화났다는 밈이 여기서 또ㅋㅋㅋㅋㅋㅋㅋㅋ,0,4 days ago,대학 갈 거야?
177,뇌절 너무 좋앜ㄲㅋㅋㄱ,1,5 days ago,대학 갈 거야?
178,이어받는 가업이 유튜브 ㅋㅋㅋㅋㅋ나중엔 3대째 편집자 집안도 나오겠네 ㅋㅋㅋㅋㅋㅋㅋ,0,5 days ago,대학 갈 거야?
179,ㅋㅋㅋㅋㅋㅋㅋㅋㅋ 버즈만 해도 괜찮은데 워치까지 다 준비했으면 붙어야지 세절대학교 총장님 맛있게 뺐었네,1,3 days ago,대학 갈 거야?
180,1:38 중년 선생님들 이렇게 모아놓고 연기시켰을거 생각하니 아찔하네 ㅋㅋㅋ,25,5 days ago,대학 갈 거야?
181,ㅋㅋㅋㅋㅋㅋ 설명 들으면서 리듬타는 표정 킹받음 ㅠ,0,5 days ago,대학 갈 거야?
182,얼마나 애들이 없으면 학교에서 애들을 데려가라고 전쟁일까ㅋㅋㅋㅋㅋㅋ,3,5 days ago,대학 갈 거야?
183,3년뒤에 수능보는 제 미래네요...ㅠ,6,5 days ago,대학 갈 거야?
184,간만에 개웃었네 ㅋㅋ,1,2 days ago,대학 갈 거야?
185,시온이 표정 너무 킹받아요,1,5 days ago,대학 갈 거야?
186,아니 왜 쇼미 심사처럼 리듬 타면서 듣고 있냐고ㅋㅋㅋㅋㅋ,1,1 day ago,대학 갈 거야?
187,진짜 뇌절인게 ㅋㅋㅋㅋ 입시설명횐데 학생 한명이고 다 대학 총장들이 와서 ㅋㅋㅋㅋ 학생 한명 데려갈려고 ㅋㅋㅋ 난리네 ㅋㅋㅋㅋ 미쳤어 ㅋㅋㅋ,0,3 days ago,대학 갈 거야?
188,아이디어 개 쩔어,1,5 days ago,대학 갈 거야?
189,진호님 대학모셔가기 홧팅,0,1 day ago,대학 갈 거야?
190,아 진짜 도랏다 ㅋㅋㅋㅋ 난이시리즈가 젤 웃김ㅋㅋㅋ,0,4 days ago,대학 갈 거야?
191,대학생 역전세계다 ㄷㄷ,0,5 days ago,대학 갈 거야?
192,"요즘은 2,3등급 섞여있어도 서울대 연대 갈 수 있다는것 보니 10년 후 대학의 의미가 궁금해지네 딱 10년 전에 내가 대학갈땐 2,3등급 섞여있음 문과라 건동홍숙도 간당간당했는데수능 2개틀린 선배가 연대떨어지고 그런 시절이였던..",8,5 days ago (edited),대학 갈 거야?
193,문과만 그럴걸요 이과는 빡셈,2,5 days ago,대학 갈 거야?
194,3등급이 서울대 연대라고? 그딴 개헛소리는 어디서 듣는거냐? 나 3등급 나왔는데 나도 제발 좀 보내줘라ㅋㅋ,0,5 days ago,대학 갈 거야?
195, @user-fg7fc8fi8b  평균 3등급이 아니라13212 이런식으로 ”섞여“있는거다우리친구 왜 3등급인지 알겠네ㅋㅋㅋㅋ,0,5 days ago (edited),대학 갈 거야?
196,뿔테안경 여자분 다른 채널에서도 몇번 봣는데 진짜 능글능글한 연기 잘하심,3,5 days ago,대학 갈 거야?
197,이현정선배 진짜 체고시다,0,2 days ago,대학 갈 거야?
