,comment,like,time,title_list
807,"so the question will be, is it possible to have the Reply1988 cast reunion? are the breakup in a bad / good term?",0,3 days ago,[sub] 10주년기념와글
808,참 재미었던 ㅎㅎㅎ,0,2 days ago,[sub] 10주년기념와글
809,이 편 너무 좋네ㅋㅋㅋㅋㅋㅋㅋㅋㅋ,8,6 days ago,[sub] 10주년기념와글
810,응사가 레전드긴 하지,1,4 days ago,[sub] 10주년기념와글
811,"그리고 2023년 현재, 엘지.. 29년만에 드디어 우승!ㅋㅋㅋ 성감독님 보고계십니까~ P.S 벌써 응사가 10주년이라니, 좋은 드라마를 만들어두신 작감 및 스태프, 배우분들 감사합니다. 한잔해~",3,5 days ago (edited),[sub] 10주년기념와글
812,요즘 트렌드가 술먹방인갑네 ㅋㅋㅋ,0,3 days ago,[sub] 10주년기념와글
813,37:46 확실히 취하셨네 ㅋㅋㅋㅋㅋㅋㅋㅋㅋㅋㅋ,1,3 days ago,[sub] 10주년기념와글
814,고아라 여전히 이쁘다,3,3 days ago,[sub] 10주년기념와글
815,고아라님 보러 왔습니다. 벌써 10년이 된 드라마라니... 2013년 가을에 봤는데 만으로 10년 돌파했네요. 모두들 행복하게 잘 사셨으면 좋겠어요. 고아라님은 피디님과 나란히 서 있는 모습이 전혀 다른 인류같아요. 키는 크신데 비율이 좋으시고 피디님은 그냥 한국인...,27,6 days ago,[sub] 10주년기념와글
816,고아라...진짜 너무 이쁘다,1,2 days ago,[sub] 10주년기념와글
817,고아라님은 유일한 스타급 아니였나? 다들 무명이 아니라,4,5 days ago,[sub] 10주년기념와글
818,응사나 봐야겠따 ㅋㅋㅋㅋㅋㅋ,1,2 days ago,[sub] 10주년기념와글
819,응칠도 고고…,1,3 days ago,[sub] 10주년기념와글
820,건축학개론 팀도 불러주세요!!,0,4 days ago,[sub] 10주년기념와글
821,응사가 10년이라니…이런 콘텐츠 너무 감사합니다,8,6 days ago (edited),[sub] 10주년기념와글
822,ㅠㅠㅠ내 인생드 응사,0,5 days ago,[sub] 10주년기념와글
823,응칠 응사 까지 모여 뒷풀이 재밌지만 몇년후 응팔은 이런 뒷풀이 볼수있을려나  덕선이 결별..,3,4 days ago,[sub] 10주년기념와글
824,i hope theres an engsub for thiss,1,5 days ago,[sub] 10주년기념와글
825,와 정우 치킨 한마리 실화냐 ㅋㅋ,0,5 days ago,[sub] 10주년기념와글
826,도희님 너무 이쁘시다 ㅜ,3,2 days ago,[sub] 10주년기념와글
827,레전드다…. 너무 감사하고 배우분들 여전히 최고,20,6 days ago,[sub] 10주년기념와글
828,신원호 감독's평온한 링거 투혼.,1,5 days ago,[sub] 10주년기념와글
829,10년이라니ㅠ 내가 21살때라니,0,3 days ago,[sub] 10주년기념와글
830,English subtitle please. I Really really need ,1,3 days ago,[sub] 10주년기념와글
831,38:57 중독성있네,0,5 days ago (edited),[sub] 10주년기념와글
832,진짜 행복하다 당신들의 추억이 내 추억같고 그래요,1,5 days ago,[sub] 10주년기념와글
833,아련하고 즐거운 추억 돋는다정말 이런 컨텐츠를 만들어준 나영석에게 감사한다너무 이쁜 아라양도 너무 진지한  정우도 저런 모습일거라 생각 못했다,28,6 days ago,[sub] 10주년기념와글
834,정말 재미있음. 드라마만큼 재미있네요.,0,3 days ago,[sub] 10주년기념와글
835,정우가 동안인건가? 김성균이랑 동갑이라니 ㄷㄷ,1,5 days ago,[sub] 10주년기념와글
836,응사때 13살이었는데 23살이에유ㅠㅠㅠㅠㅠ 나 응사 10번은 봤다....,1,5 days ago,[sub] 10주년기념와글
837,아 너무 좋아요오~~ 그 시절 나의 인생드라마 응사,0,5 days ago,[sub] 10주년기념와글
838,우와 대박이다   ,0,4 days ago,[sub] 10주년기념와글
839,"이런모임이 진짜 부러우면서 재미있고 기억 ,추억 절대 잊을수가 없는날인데  참 부럽다",9,6 days ago,[sub] 10주년기념와글
840,응사 감동과 휴먼에 역사적인 드라마죠 해바라기유 아니면 현미유 바삭하게 튀길수도,0,1 day ago (edited),[sub] 10주년기념와글
841,다들 외모가 그대로시네,0,4 days ago,[sub] 10주년기념와글
842,"슬의생 출연자 님들도 보고 싶네요,,,",0,5 days ago,[sub] 10주년기념와글
843,요새 앞광고는 조금 더 대놓고 어색한게 포인트~ ㅋㅋ,0,19 hours ago,[sub] 10주년기념와글
844,아 성균이형 이때 학생으로 나왔엇지 ㅋㅋㅋㅋㅋㅋㅋㅋㅋㅋ,0,4 days ago,[sub] 10주년기념와글
845,와~ 벌써 10년전이라니 ..블루레이도 소장할만큼 애정한 드라마인데 다들 넘 반갑,81,6 days ago (edited),[sub] 10주년기념와글
846,[ 대주고 가는 유부 많은곳 찾았다 ]=들려서 어딘지 보고 가거라=,0,6 days ago,[sub] 10주년기념와글
847,벌써 십년 ㅠ,0,4 days ago,[sub] 10주년기념와글
848,고아라는 뱀파이어다.. 여전히 예쁘다,2,3 days ago,[sub] 10주년기념와글
849,하아 진짜 쓰레기 오빠는 레전드 ㅋㅋ 저는 칠봉이를 제일 좋아했습니다. 알러뷰 칠봉이,1,4 days ago,[sub] 10주년기념와글
850,응사 쓰레기 칠봉이 레전드였죠....,1,5 days ago,[sub] 10주년기념와글
851,응사  막 방송시작핱때  군대가버려서   이 드라마보면 군대있을때  생각남   응답하라 시리즈는  가끔생각나면 정주행하는  드라마임,0,5 days ago,[sub] 10주년기념와글
852,아 진짜 손호준 방울토마토 너무 웃겨 ㅋㅋㅋㅋㅋㅋㅋㅋㅋㅋㅋㅋㅋㅋ,20,6 days ago,[sub] 10주년기념와글
853,10년이 됬는데도 아직도 대부분이 30대 초반이라니...다들 엄청 어렸겠다..고아라 배우님 원래 이렇게 예쁜 분이였는데 역할 땜에 살찌워야 했던 비하인드가 있었네요 ㅎㅎ,0,4 days ago,[sub] 10주년기념와글
854,도희 오랜만에 보네요 제일 좋아햇는 케릭이였어요,1,5 days ago,[sub] 10주년기념와글
855,응팔도 해주세요ㅠㅠㅠㅠㅠㅠㅠㅠㅠ,1,15 hours ago,[sub] 10주년기념와글
856,꺄아ㅠㅠㅠㅠㅠ,0,5 days ago,[sub] 10주년기념와글
857,선우야 오랜만에 보니 좋구나....,1,5 days ago,[sub] 10주년기념와글
858,존경하는 나영석피디님. 우리 응사 식구들 데리고 예능 하나 더 찍어주세요 아진짜제발,27,6 days ago,[sub] 10주년기념와글
859,내 최애 나피디 내 최애 응사,0,5 days ago,[sub] 10주년기념와글
860,"아라언니,,️예쁜사람이 성격까지 좋냐구여,,고민상담하고싶다,,,,옆집언니같애",2,4 days ago,[sub] 10주년기념와글
861,나정이 일화엄마 딸 아니랄까봐 손 큰 거 봐...,2,5 days ago,[sub] 10주년기념와글
862,차선우.. 너 진짜 내가 사랑했었다.. 8년을 사랑했어..,2,4 days ago,[sub] 10주년기념와글
863,현생 최애 드라마.응답시리즈,1,5 days ago,[sub] 10주년기념와글
864,아~정말 재밌었어요. 벌써 10년이라니..저 멤버 그대로 또 다시 새 드라마로 볼 수 있었음 좋겠어요. 다들 더 잘되시고 건강하시고 행복하세요~,11,6 days ago,[sub] 10주년기념와글
865,와...응사가 벌ㅆㅓ 10주년이라니..ㅠ,0,4 days ago,[sub] 10주년기념와글
866,놀라운건 응사에 출연했던 사람들이 지금까지 단 한번도 사고를 안쳤다는것이다,1,5 days ago (edited),[sub] 10주년기념와글
867,AAAA KANGEN BARO,0,5 days ago,[sub] 10주년기념와글
868,38:13 나피디님ㅋㅋㅋㅋ이쯤 취하신것갇ㅅ은뎈ㅋㅋㅋㅋㅋ말ㅋㅋㅋ꼬이시는데,0,2 days ago,[sub] 10주년기념와글
869,Hua my fav reply series  wish eng trans came faster,0,3 days ago,[sub] 10주년기념와글
870,아라쨩ㅋㅋㅋ성격되게좋으시네욤ㅋㅋㅋㅋㅋㅋㅋ기여움 마니마니티비에나와주세요 모두들,12,6 days ago,[sub] 10주년기념와글
871,응사가 젤 잼있음,0,3 days ago,[sub] 10주년기념와글
872,이때 드라마랑 비슷한 상황으로 사귀다 나중에 헤어졌는데 내 인생에서의 사랑 중 가장 가슴 찢어지게 아파서 몇년동안 누구도 못 만나고 힘들었지그래도 응사 볼때마다 그때 너무 좋았던 너무 아팠던 생각이 난다.지금은 그래도 참 두근거렸던 추억이네ㅎㅎ,0,3 days ago,[sub] 10주년기념와글
873,I hope you have subtitle ,0,5 days ago,[sub] 10주년기념와글
874,아라 사랑 나라 사장..더 이뻐지신듯 ㅋㅋ,2,5 days ago,[sub] 10주년기념와글
875,zzz 전부 광고 멘트 하는거 개웃겨 ㅋㅋ,1,5 days ago,[sub] 10주년기념와글
876,연출 없는 모습이지만  6시간만에 73만 조회수는많은 이들이 응사를 사랑했다는 증명,23,6 days ago (edited),[sub] 10주년기념와글
877,신원호 PD님 외전으로 응사 2 해주면 안될까요?,1,3 days ago,[sub] 10주년기념와글
878,정우가 가져온 치킨 어디꺼에요? 넘 궁금해요~,1,5 days ago,[sub] 10주년기념와글
879,레전드,1,4 days ago,[sub] 10주년기념와글
880,40분이 언제 지났는지 모르고 봤네요ㅎ,0,2 days ago,[sub] 10주년기념와글
881,고아라님 로맨스 드라마 많이 찍어주셨으면🥹️,5,5 days ago,[sub] 10주년기념와글
882,해태 손호준이 정말 매력 터졌었죠. 연기도 너무 잘했고,37,6 days ago,[sub] 10주년기념와글
883,응팔은 10주년되도 주인공들.............. 데리고 할 수가 없겠네요ㅠㅠ그렇다면 응팔은 10주년 때 부모님 역할 했던 분들로 하는 건 어떤지.....?,1,3 days ago (edited),[sub] 10주년기념와글
884,성동일 있었으면 더 대박이었을듯,0,3 days ago,[sub] 10주년기념와글
885,응사가 10년이라고???!! 내 십년 어디갔어?? 아 바쁘게 살았지 참..,2,5 days ago,[sub] 10주년기념와글
886,"<(남주 외모 때문에)멜로가 안되면 코믹으로 간다>는 생각이었단 거 보고, 대본도 연기도 다 훌륭했다고 말씀드리고 싶음. 왜냐면, 전 응사를 비교적 최근에 완주했고, 그 전엔 유툽의 클립으로만 봐서 대충 스토리를 아는 정도. 그래서 나정이가 왜 칠봉이를 두고 쓰레기를 좋아하는지 이해안됐음. 나같음 뒤도 안돌아보고 칠봉인데 하며. 그런데 응사 드라마를  본격적으로 보게 되고 회차 지날수록 점점 쓰레기가 저렇게 잘 생겼었나? 저렇게 멋진데 왜 난 몰랐지?? 하고 약간 놀랐음..",0,3 days ago,[sub] 10주년기념와글
887,고아라 약간 말투가 천송이 같네..ㅋㅋㅋ,4,5 days ago,[sub] 10주년기념와글
888,와 .. 보는 것만으로 응답하라 보던 그 시절로 돌아간 기분이야 미쳤다,39,6 days ago,[sub] 10주년기념와글
889,프사 꾸욱..오랜만에 만난 여사친 무삭제 영상,0,6 days ago,[sub] 10주년기념와글
890,너무 좋다~  응팔도 해주세효~()(),0,4 days ago,[sub] 10주년기념와글
891,응칠 멤버도 함 모아주세요 제브아아ㅏ아알 ㅜㅜ~~~~~~~!~~~~~~~~~~~~!,2,2 days ago,[sub] 10주년기념와글
892,와 대박 속으로 생각했던게 헐 와,1,5 days ago,[sub] 10주년기념와글
893,"응사 방송 당시...여기 모인 주역들...고아라를 제외한 대부분이 갓 얼굴 알린 정도이거나 완전 무명이었는데...지금은 대부분이 주연급, 스타급 배우가 되었네요.",4,4 days ago (edited),[sub] 10주년기념와글
894,엘지트윈스가 우승해서 오랜만에 응사 보는중이었는데 이게 올라오네요!,0,5 days ago,[sub] 10주년기념와글
895,내 나이 40세. 이 드리마처럼 설레이면서 따뜻했던 드라마가 있었나 싶네요 기회가 된다면 이 맴버 그대로 또 뭐 하나 일냅시다^^,17,6 days ago,[sub] 10주년기념와글
896,많은 사람들이 응팔을 시리즈 최고로 뽑지만 저한테는 응사가 최고입니다 (물론 응팔도 좋아합니다),0,3 days ago,[sub] 10주년기념와글
897,와 이맴버 어떻게 모앗데~,0,4 days ago,[sub] 10주년기념와글
898,응답하라 2002 아니면 응답하라 2004~05년 해주세요!!!ㅋㅋㅋㅋ,0,5 days ago,[sub] 10주년기념와글
899,내가젤좋아하는 응사,0,3 days ago,[sub] 10주년기념와글
900,Indonesian Sub pleaseeeeee Na PD Nim!!! T.T,0,4 days ago,[sub] 10주년기념와글
901,"쓰성의 탄생~~~ㅎㅎ응사가 젤 좋았던 덕후로써 뭔가 주목 받지 못한것 같아 항상 아쉬웠어요ㅜㅜ캐릭터 하나하나 다 소중하고 몽글몽글한 응사 특히 쓰레기... 동갑내기 과외하기부터 응원했어요!!! 막 팬은 아닌데 은근 다 봐습니다ㅋㅋ 연기 스타일 좋아요~~ 응사 배우, 스텝분들 모두 행복하세요",22,6 days ago,[sub] 10주년기념와글
902,응사좋아해서 응사커플 결혼한날짜에 결혼했어요,1,3 days ago,[sub] 10주년기념와글
903,정우님~드라마 찍어줘요,2,5 days ago,[sub] 10주년기념와글
904,응사가 벌써 10주년이래..근데 왜 배우분들은 다 그대로세요..?,2,5 days ago (edited),[sub] 10주년기념와글
905,같은 정국으로써 응원합니다 ^^,0,5 days ago,[sub] 10주년기념와글
906,맞다 정우랑 손호준 바람 같이 출연했다 ㅋㅋ,2,5 days ago,[sub] 10주년기념와글
907,엘지 우승하고 행복한 주간에 응사라니ㅠㅠ 이번 와글 멤버에 가슴이 몽긍몽글해집니다 ,6,6 days ago,[sub] 10주년기념와글
908,나에겐 응사가 최고..,0,5 days ago,[sub] 10주년기념와글
909,여기서 잠깐 흘러나오는 에픽하이의 노래제목이 궁금하네요,0,1 day ago,[sub] 10주년기념와글
910,"정우 배우 , 피식대학에 출연해서 부산사투리호소인 참교육 기원 10일차",0,5 days ago,[sub] 10주년기념와글
911,10 years passed?  wtf I'm old ,0,1 day ago,[sub] 10주년기념와글
912,호준이나와서 하는말인데 도대체 삼시세끼 후속편 언제나와요? 미치고 환장하겟네 ㅜㅜ,12,6 days ago,[sub] 10주년기념와글
913,뒤로 갈수록 다들 얼큰해지는거 너무웃김ㅋㅋㅋㅋㅋㅋㅋㅋ,6,6 days ago,[sub] 10주년기념와글
914,응사멤버들 케미가 10년이 지나도~ 쭉쭉 오래가셨으면 좋겠습니더~,12,6 days ago,[sub] 10주년기념와글
915,선우 이렇게 보니 너무나 반갑고 좋아요🥹🫶응사멤버 영원해..,40,6 days ago,[sub] 10주년기념와글
916,헐.............,0,5 days ago,[sub] 10주년기념와글
917,고아라가 진짜 잘받아주네 리액션 개좋음,10,6 days ago,[sub] 10주년기념와글
918,최애드라마 멤버들 아직 연락하며 사이좋게 지내는게 참 보기 좋다,22,5 days ago,[sub] 10주년기념와글
919,"슬빵,슬의생도 요로케 모이자요~~그리고 감독님 뭐 하나 더 만들어주세요 뭐든 좀.. 너무 추억 돋아 못살겠어욬 ㅋㅋ ",9,6 days ago (edited),[sub] 10주년기념와글
920,미쳤다 이 조합이 다시 모이다니,7,6 days ago,[sub] 10주년기념와글
921,응답 시리즈 뿐만이 아니라 모든 드라마 통틀어서 응사는 제 인생드라마에요 모든 캐릭터들 뚜렷하고 대사 연기 호흡 가족애 우정 사랑 뭐 하나 빠지는게 없어요. 거기다가 가장 매력적인 전국 8도 사투리! 그룹 케미가 이렇게 좋으니 드라마가 왜 그렇게 재밌었는지 이해가 되네요. 앞으로도 자주자주 모여주세요!!! 응사 최고 ,24,6 days ago,[sub] 10주년기념와글
922,하루도 안됐는데 조회수ㄷㄷ 응답시리즈는 시간이 지나도 화제성 원호감독님 응답4 찍으셔야겠는데요!,18,6 days ago,[sub] 10주년기념와글
923,다시 이 멤버로 드라마 한편 찍으면 좋을것 같아요 손호준배우님 나영석pd님 유투브에 언제 출연하나 했는데 이럼게 보니 좋아요 ,14,6 days ago,[sub] 10주년기념와글
924,"10년지났다는것도 놀랄것이긴한데, 이조합이면 다들 사고도 없으시고, 장르 불문하고 좀더 진한 장르로 모여도 성공할거같다 ㅎ",8,6 days ago,[sub] 10주년기념와글
925,이 조합 귀하다고ㅠㅠㅠㅠㅠㅠㅠㅠ,13,6 days ago,[sub] 10주년기념와글
926,와 며칠 전에 응사 보기 시작해서 어제 끝까지 다 보고 응사 컨텐츠 유튜브에 서치하고 다녔는데 이게 웬 횡제 ㅠㅠ 영석님 나무너무 감사합니다,6,6 days ago,[sub] 10주년기념와글
927,와 이런 와글와글은 강추입니다!!!영석피디님의 이런솔직한모습도 좋고 다들 솔직하고 좋은분위기의 모습도좋네요!! 응사 또 보고싶네요 ㅠ,7,6 days ago,[sub] 10주년기념와글
928,다른 시리즈들도 다른 의미로 화제성이 컸지만 응사는 에피소드 하나하나가 그시절 젊은 시절을 겪은 사람들이 공감할만한 에피소드들을 자연스럽게 웃기게 풀어내서 유튜브 쇼츠각으로 많이 접함.,7,5 days ago,[sub] 10주년기념와글
929,내 인생작 응답하라 시리즈 PD님에 배우분들에 나영석PD님의 조합이라니~ 미친듯이 너무 좋아요,33,6 days ago,[sub] 10주년기념와글
930,[ 대주고 가는 유부 많은곳 찾았다 ]=들려서 어딘지 보고 가거라=,0,6 days ago,[sub] 10주년기념와글
931,"요즘 날씨에 딱 응사 생각나서 얼마전에 다시 정주행했는데!!!!🥹🥹 다 보자마자 요게 떠서 넘 좋네요 벌써 10년이라니…세월 참 빠르다,,,",7,6 days ago,[sub] 10주년기념와글
932,"미쳐따........... 당시에 바나여서, 우리 선우오빠 덕분에 좋은 작품 봐서 너무 좋았는데... 그게 벌써 10년전 🥹 다들 무사히 배우하고 있어줘서 고마워요옹..🩷",13,6 days ago,[sub] 10주년기념와글
933,미쳤다!!! 응답하라중에 응사 제일 좋아해서 아직도 가끔 봄 ㅠㅠㅠㅠㅠㅠ 벌써 10년이나 됐구나.. 내 최애 드라마,9,6 days ago,[sub] 10주년기념와글
934,아니 진짜 미쳐따!!!!!!!!!!!! 나피디님 못하는게 머야???? 아니 와 진짜 대박,11,6 days ago,[sub] 10주년기념와글
935,진짜 말도 안 된다 ㅋㅋㅋㅋ 응사가 10년이나 됐다니 시간 참 ㅋㅋ...,10,6 days ago,[sub] 10주년기념와글
936,응사할때 대학교 2학년때라 그때 제 동기들 보는거 같아서 너무 잘 봤어요ㅠㅠ 10년동안 졸업하고 어느새 직장생활 7년차.. 10년전에는 같이 밤새도록 술마시고 영원할 것처럼 웃고 떠들었는데 지금은 한두명 연락하는 친구 빼고는 어디서 잘 살고 있겠지..하고 있네용.. 뭔가 마음 뭉클하고 다시 동기들한테 연락하고 싶어지는 영상이었습니다 ㅎㅎ,13,5 days ago,[sub] 10주년기념와글
937,손호준 유연석 예능 한 번 더 보고싶다,44,6 days ago,[sub] 10주년기념와글
938,ㅠㅠㅠㅠㅠ응사 하숙생활인데 내가 껴든거 같은 기분.. 이 분위기 너무 좋다,8,6 days ago,[sub] 10주년기념와글
939,틀자마자 나PD의 앙탈이라니....이건 귀하군요;;,64,6 days ago,[sub] 10주년기념와글
940,"아직도 응답하라 앓이 하고있었는데 너무 반가운데, 칠봉이 안나온게 너무 아쉽네요ㅠㅠ중간에 스무스하게 나온 피피엘 디퓨저도 평소 쓰는건데 반응에 딴 도희님 반응 향 이기회에 할인가로 쟁여두겠슴다ㅋㅋㅋ",9,6 days ago,[sub] 10주년기념와글
941,응사가 레전드지.... 남중남고를 나와 학창시절 로맨스가 없는 나로서는 다룬 작품들보다 대학과 성인을 다룬 응사가 더 공감이됐음...,22,5 days ago,[sub] 10주년기념와글
942,감사합니다. 여러분들 덕분에 행복했습니다. ,415,6 days ago,[sub] 10주년기념와글
943,손차유 다나왔네 ㅋㅋㅋㅋ 응답하라 시리즈 슬기로운 시리즈는 진짜 매번 정주행해도 진심 꿀잼이다,12,6 days ago,[sub] 10주년기념와글
944,"아라배우님,, 진짜 성격 좋은게 눈에 다 보임 ㅠㅠ 엄청 밝은사람이당,,",17,6 days ago,[sub] 10주년기념와글
945,응답시리즈 중 젤 최애인 응사♡반가운 모습 보여주셔서 고마워요🫶,15,6 days ago,[sub] 10주년기념와글
946,"연석씨랑 우정pd님이 없어서 아쉽지만ㅜㅜ 그래도 예전 추억 떠올라서 너무 좋았습니다^^ 응답시리즈 중 제일 좋아하는 응사..배우들의 연기력,케미,ost까지 완벽했던..",10,6 days ago,[sub] 10주년기념와글
947,분량 45분 미쳤다 ,13,6 days ago,[sub] 10주년기념와글
948,"아 어떡해 🥹 다들 응팔 좋아해도 응답하라 시리즈의 절정은 ㄹㅇ 응사임..나 존버 했어 징짜ㅠㅠㅠ 너무 행복해 그때 응사 최종화 비하인드 보는거 같아서  그때 그 감성 그대로라서 다들 사랑해요 진짜,,,",31,6 days ago,[sub] 10주년기념와글
949,손호준 너무 잘생겼네화면에 슬쩍 잡힐때마다넘 잘생겨서 깜놀,7,6 days ago,[sub] 10주년기념와글
950,이제 좀 별거 없겠지 하면 미치게 재밌는영상주네. .미취겠네 진짜,9,6 days ago,[sub] 10주년기념와글
951,모야 불금에 퇴근하는데 너무 좋자나!!!!!,16,6 days ago,[sub] 10주년기념와글
952,[ 대주고 가는 유부 많은곳 찾았다 ]=들려서 어딘지 보고 가거라=,0,6 days ago,[sub] 10주년기념와글
953,도희씨가 분위기 메이커네 ~~~ 센스가 있어요 ㅎㅎ,7,6 days ago,[sub] 10주년기념와글
954,손호준 왤케 잘생김 미쳤다,7,6 days ago,[sub] 10주년기념와글
955,응사가 벌써 10년이라니 세월이 유수와같다는 말이 생각나네요. 모두들 건강하게 롱런하세요~~~,6,6 days ago,[sub] 10주년기념와글
956,아니 이걸 예고 없이 보여준다고요 너무햇 ㅎㅎ 완전 좋아,12,6 days ago,[sub] 10주년기념와글
957,프사 꾸욱..오랜만에 만난 여사친 무삭제 영상,0,6 days ago,[sub] 10주년기념와글
958,손호준님 토마토도키우시고 대단하세요~~오랜만에 응사식구들 너무너무반갑고좋아요~~~^^  모든배우님들 다시보고싶습니다~~,39,6 days ago (edited),[sub] 10주년기념와글
959,드라마 한 편에 11커플을 레전드네ㅋㅋㅋㅋㅋㅋㅋㅋㅋㅋㅋㅋ,17,6 days ago,[sub] 10주년기념와글
960,37:00 부터 나PD님 취해서 혀꼬이시는거 너무 귀여우신데요 ㅋㅋㅋㅋㅋㅋㅋㅋㅋㅋㅋㅋㅋㅋ,7,6 days ago,[sub] 10주년기념와글
961,"응사시리즈는 지금 다시 나오면 분명 더 뜰거임.모든 배역이 찰떡일 만큼 너무 잘 어울렸는데, 개인적인 생각으로 쓰레기 역할은 정우 아니면 진짜 아무도 못함. ",22,6 days ago,[sub] 10주년기념와글
962,손호준 순장 얘기까지 나온 판에.. 삼시세끼든 나불나불이든 한번더 나와야한다고 봅니다,27,6 days ago,[sub] 10주년기념와글
963,ㅠㅠㅠㅠㅠㅜ진짜 미쳤다…. 정우 넘 멋져요ㅠㅠ 똑같다 진짜,7,6 days ago,[sub] 10주년기념와글
964,세상에 내 눈을 의심했다ㅠㅠㅠㅠㅠㅠ 행복했던 응사!!!!!!! 벌써 10년이라는게 정말 놀랍네요...............!,7,6 days ago,[sub] 10주년기념와글
965,하 응답하라는 시즌마다 너무재밌었어 다들 케미도 장난아니고 너무좋아,14,6 days ago (edited),[sub] 10주년기념와글
966,헐 ㅠㅜ 개인적으로 정말 좋아했던 응사..선우가 나와서 더 좋아했던 응사..몇일 전에도 정주행 했던 응사..이런싯으로 또 보이니까 반갑고 또 반갑다 ㅠㅜ,6,5 days ago,[sub] 10주년기념와글
967,응사가 응답시리즈중 최애드라마였어요. 다들 십년동안 아무일없이 앉아계신다는 것만으로도 너무 좋은사람들이란게 느껴지네요 이멤버 원츄!~,8,6 days ago,[sub] 10주년기념와글
968,진짜 거짓말 아니고 응사 10번 넘게 본 제 최애 드라마인데 너무 감사합니다️,10,6 days ago,[sub] 10주년기념와글
969,프사 꾸욱..오랜만에 만난 여사친 무삭제 영상,0,6 days ago,[sub] 10주년기념와글
970,와 근데 손호준 진짜 너무 잘생겼네 ;;,6,6 days ago,[sub] 10주년기념와글
971,연말 느낌나고 너무 좋아요~,15,6 days ago,[sub] 10주년기념와글
972,고아라처럼 저런 모임 계속 유지되도록 노력해주는 사람이 참 고맙다참 귀찮고 쉽지 않은 일인데 얼마나 사이 좋고 다들 잘 응해주면~,11,5 days ago,[sub] 10주년기념와글
973,"제 인생 드라마가 응사인데 하숙집은 아니지만 10년이 지나도 그 시절, 그모습 그대로 인 것 같아요응사와 멤버들 그리고 콘서트도 잊지 못할 것 같아요 모두들 좋은 연기와 활동 보여주고 있어서 고맙고 앞으로도 늘 응원할게요 응사 화이팅~",7,6 days ago (edited),[sub] 10주년기념와글
974,응사는 이상하게 진짜 가족같은 느낌이 있음… 하숙집에서 같이 산다는 설정이었어서 그런가 진짜 가족같고 넘 보기좋음 ㅎㅎ 보고있음 뭔가 몽글몽글한 기분도 들고ㅠㅠ 내 인생 드라마…,7,6 days ago,[sub] 10주년기념와글
975,"성나정이라는 캐릭터를 200프로 소화했던 고아라양, 만찢녀의 느낌이었는데... 빨리 또 인생 드라마 찍어주길 늘 응원합니다.1화 시작, 쓰레기 정우와 싸우는 장면은 진짜 압권이었네요. 응사는 지금도 우리 가족의 밥친구입니다. ㅎ",8,5 days ago (edited),[sub] 10주년기념와글
976,고아라 성격 좋다 스탭꺼까지 다 챙기고 다른 배우들 말에 리액션 해주고 어릴때 배우 시작해서 사회생활 일찍했다지만 그런거라고만 보기에는 성격 자체가 좋네,6,6 days ago,[sub] 10주년기념와글
977,미쳤다... 응답시리즈 중에 내가 제일 좋아하는 응사 ㅠㅠㅠㅠㅠㅠㅠㅠ,7,6 days ago,[sub] 10주년기념와글
